PublishDate,Source,Type,Title,Summary,Link
2025-10-03,Schott,Company News,SCHOTT Inspires Next Generation During Manufacturing Day 2025,"SCHOTT celebrates Manufacturing Day with school visits across four states, connecting students with modern manufacturing careers Company launches third annual SCHOTT Innovation Challenge with $1,000 prize Initiative aligns with the resurgence of American manufacturing sector, a backbone of the economy, which grew 5% in employment to 12.6 million jobs and 19% locations to 401,000 over the last decade",https://www.schott.com/en-us/news-and-media/media-releases/2025/schott-inspires-next-generation-during-manufacturing-day-2025
2025-10-03,JARN,Industry News,Alfa Laval FCM LPG chosen as the fuel supply system for four new LPG carriers,"Alfa Laval FCM LPG fuel supply system has been selected for four new LPG carrier projects by two leading shipyards in Asia. Known for its efficient performance and design flexibility, the system continues to support the marine industry’s transition through reliable and adaptable fuel supply solutions.",https://www.ejarn.com/article/detail/90679
2025-10-03,JARN,Industry News,Samsung and OpenAI Announce Strategic Partnership To Accelerate Advancements in Global AI Infrastructure,"Samsung will bring together industry-leading technologies and innovations across advanced semiconductors, data centers, shipbuilding, cloud services and maritime technologies",https://www.ejarn.com/article/detail/90678
2025-10-03,JARN,Industry News,"Heat Pumping Technologies Magazine Issue 2, 2025 Out Now","Welcome to Heat Pumping Technologies MAGAZINE, Vol.43 No.2/2025. For the first time, we have migrated to our new, advanced website, and to reflect its fresh identity, this second issue of 2025 features an updated layout, spotlighting a timely and forward-looking theme: Smart Controls and AI for Next-Generation Heat Pump Efficiency. As the heat pump sector continues to evolve, the integration of intelligent control systems, data-driven optimization, and artificial intelligence (AI) is proving essential for achieving higher efficiency, reliability, and user-centric operation.",https://www.ejarn.com/article/detail/90681
2025-10-03,JARN,Industry News,Carrier Rebrands Global Command Centers to Advance Customer Outcomes,"., Oct. 2, 2025 /PRNewswire/ -- Carrier Global Corporation (NYSE: CARR), global leader in intelligent climate and energy solutions, today announced the rebranding of its global command centers as Carrier Customer Command Centers. The new identity underscores Carrier's customer-first commitment and the growing role of the centers in helping customers improve energy efficiency, increase equipment uptime, strengthen temperature compliance and lower maintenance costs.",https://www.ejarn.com/article/detail/90690
2025-10-03,Natural Refrigerants,Industry News,Interview: LYD Sales Manager Highlights the Company’s CO2 Heat Pump Projects in China,LYD has installed 140 CO2 heat pumps in China. ..,https://naturalrefrigerants.com/news/interview-lyd-sales-manager-highlights-the-companys-co2-heat-pump-projects-in-china/
2025-10-03,CoolingPost-Products,Industry News,Clivet updates Zephir4 air renewal series,"ITALY: Clivet’s new generation of Zephir4 air renewal and purification units come with air flow rates from 2,300 to 19,000m³/h, full inverter technology and R32 refrigerant.",https://www.coolingpost.com/products/clivet-updates-zephir4-air-renewal-series/
2025-10-03,CoolingPost-UK,Industry News,Wolseley to stock Haier renewable products,"UK: The Wolseley Group’s Plumb Centre branches are now a source for Haier’s range of renewable products, including air-source heat pumps, smart controls, and battery storage systems.",https://www.coolingpost.com/uk-news/wolseley-to-stock-haier-renewable-products/
2025-10-03,CoolingPost-World,Industry News,Desiccant AC joins Amazon’s development scheme,"USA: Florida-based Blue Frontier, a developer of air conditioners using liquid desiccant technology, has joined Amazon’s Sustainability Accelerator programme to accelerate the development of climate breakthrough technologies.",https://www.coolingpost.com/world-news/desiccant-ac-joins-amazons-development-scheme/
2025-10-03,RefIndustry,Industry News,Daikin launches air quality innovation trials at Toyota Woven City,Daikin Industries has begun demonstration trials of two next-generation air management systems at Toyota Woven City in Japan. The company is testing solutions to create both “pollen-free spaces” a,https://refindustry.com/news/market-news/daikin-launches-air-quality-innovation-trials-at-toyota-woven-city
2025-10-03,RefIndustry,Industry News,Wolseley partners with Haier to expand UK renewables range and training,"Wolseley Group has announced a strategic partnership with Haier HVAC Solutions to enhance access to low-carbon technologies and support installer training across the UK. Starting in October, Haier�",https://refindustry.com/news/market-news/wolseley-partners-with-haier-to-expand-uk-renewables-range-and-training
2025-10-03,RefIndustry,Industry News,ARENA funds low-emission heat tech at major Australian manufacturers,The Australian Renewable Energy Agency (ARENA) has announced over AUD 12 million (approx. USD 7.7 million) in funding to support low-emission process heat technologies at three major Australian manufa,https://refindustry.com/news/market-news/arena-funds-low-emission-heat-tech-at-major-australian-manufacturers
2025-10-03,JARN,Industry News,Dunham-Bush Showcases Athena ACM-AE Oil-free Chiller at MARVEX 2025,"At the MARVEX 2025 in Malaysia, Dunham-Bush showcased its Athena ACM-AE series oil-free air-cooled magnetic bearing chiller. The unit features oil-free magnetic bearing compressor technology, an eco-friendly HFO refrigerant, and variable speed EC condenser fans, delivering high energy efficiency and superior IPLV performance. It offers optional integrated free-cooling and adiabatic cooling capabilities and is AHRI certified. The Athena ACM-AE series stood out at the show as a high-performance, eco-conscious solution, designed specifically for demanding cooling applications—particularly mission-critical data centers and large-scale commercial facilities.",https://www.ejarn.com/article/detail/90691
2025-10-03,RefIndustry,Industry News,Global Refrigerated Transport Market to Reach USD 232.9 Billion by 2034,"The global refrigerated transport market is projected to grow from USD 113.5 billion in 2025 to USD 232.9 billion by 2034, registering a compound annual growth rate (CAGR) of 8.3%, according to a",https://refindustry.com/news/market-research/global-refrigerated-transport-market-to-reach-usd-232-9-billion-by-2034
2025-10-03,JARN,Industry News,Salt River Project Completes Hydropower Modernization Project for Greater Renewable Energy Production Efficiency and Reliability,"SRP’s Roosevelt Dam, situated along the Salt River in Arizona, is one of three critical hydropower sites modernized with the Ovation™ Automation Platform to help ensure operational continuity and drive increased performance. Photo credit: SRP.",https://www.ejarn.com/article/detail/90689
2025-10-03,JARN,Industry News,Meet HPT TCP at the European Heat Pump Summit in Nuremberg!,"In the end of October the European Heat Pump Summit will bring together leading figures from industry, research and policy with an interest in heat pumping technologies, and of course several representatives from the HPT TCP will be there!",https://www.ejarn.com/article/detail/90682
2025-10-03,JARN,Industry News,Saudi Arabia joins global effort against climate change as 166th country to ratify the Kigali Amendment,"On September 10, 2025, Saudi Arabia ratified the Kigali Amendment to the Montreal Protocol. The Amendment shall enter into force for Saudi Arabia on 9 December 2025.",https://www.ejarn.com/article/detail/90687
2025-10-03,JARN,Industry News,Mitsubishi Electric: supermarkets,"In today’s food retail landscape, several types of supermarkets cater to different consumer needs. Traditional supermarkets are medium-sized stores located in urban or residential areas, offering a full range of food and everyday products. Hypermarkets are large-scale outlets, often found in suburban areas, that also sell non-food items such as electronics, clothing, and household goods. Organic or specialized supermarkets focus on natural, local, or diet-specific products, ideal for those seeking more conscious nutrition. Convenience stores provide quick shopping solutions thanks to their central locations and extended hours.",https://www.ejarn.com/article/detail/90688
2025-10-03,JARN,Industry News,Resideo Launches Next-Generation Honeywell Home Dehumidifier,"(Sept. 30, 2025) – Resideo Technologies, a leading global provider of home comfort, energy management, safety and security solutions, today launched its new Honeywell Home Whole Home Dehumidifier. The company’s most advanced indoor air quality (IAQ) product offers unsurpassed installation efficiencies and elevates expectations for the dehumidification category.",https://www.ejarn.com/article/detail/90686
2025-10-03,JARN,Industry News,"PG-AHU re-elects Lenz & Bijmans as Chair, Vice-Chair",The Eurovent Product Group Air Handling Units (PG-AHU) has re-elected Martin Lenz as Chairperson and Andy Bijmans as Vice-Chairperson. The election took place during the group’s latest meeting at the Eurovent Summit in Prague.,https://www.ejarn.com/article/detail/90685
2025-10-03,JARN,Industry News,MHI Signs Memorandum of Agreement with University of the Philippines to Consider Decarbonization Strategies in the Philippines,"・ Adopted by Japan's Ministry of Economy, Trade and Industry as a subsidy project, with MHI conducting research to consider the optimal power supply configuration",https://www.ejarn.com/article/detail/90684
2025-10-03,JARN,Industry News,Turboden selected to deliver 180 MW of Fervo’s Gen 2 ORC Power Plants at Cape Station in Utah.,"After delivering 120 MWe of Gen 1 ORC equipment to Phase I, Turboden is again selected to participate in Phase II. In support of its growing presence in North America, Turboden America LLC has been fully operational since October 2024.",https://www.ejarn.com/article/detail/90683
2025-10-02,Natural Refrigerants,Industry News,Enerin to Install 1.2MW HoegTemp High-Temperature Heat Pump Using Helium at a Roche Switzerland Facility,"The heat pump will produce 171°C steam year-round at 6bar pressure, which ..",https://naturalrefrigerants.com/news/enerin-to-install-1-2mw-hoegtemp-high-temperature-heat-pump-using-helium-at-a-roche-switzerland-facility/
2025-10-02,Natural Refrigerants,Industry News,U.S. EPA Proposes 5- to 6-Year Delays in GWP Limits for Retail and Cold Storage,The implementation of 150 or 300 GWP limits on refrigerants in supermarket ..,https://naturalrefrigerants.com/news/u-s-epa-proposes-5-to-6-year-delays-in-gwp-limits-for-retail-and-cold-storage/
-----,Lennox,Company News,Failed scrape,Please visit the site instead.,https://investor.lennox.com/news-events/news-releases
-----,Panasonic HVAC,Company News,Failed scrape,Please visit the site instead.,https://www.panasonic.com/global/hvac/news.html
-----,Parker Sporlan,Company News,Failed scrape,Please visit the site instead.,https://www.parker.com/us/en/about-parker/newsroom/news-release-details.html
-----,Sensata,Company News,Failed scrape,Please visit the site instead.,https://www.sensata.com/newsroom
-----,Watsco,Company News,Failed scrape,Please visit the site instead.,https://investors.watsco.com/news
-----,IEA,Industry News,Failed scrape,Please visit the site instead.,https://www.iea.org/news
-----,HPA,Industry News,Failed scrape,Please visit the site instead.,https://www.heatpumps.org.uk/news-events/
-----,Carel,Company News,Failed scrape,Please visit the site instead.,https://www.carel.com/news
