PublishDate,Source,Type,Title,Summary,Link
2025-04-22,AtmosZero,Company News,An Iconic Brewery is Installing a Giant Heat Pump to Clean Up Its Emissions,"Article leads to a 3rd-Party site, please visit the news page instead.",https://www.bloomberg.com/news/features/2025-04-22/new-belgium-brewing-is-installing-a-giant-heat-pump-to-clean-up-its-emissions
2025-04-21,AtmosZero,Company News,How 12 Climate Tech Startups Are Shaping the Energy Transition in a Turbulent World,"Article leads to a 3rd-Party site, please visit the news page instead.",https://www.bloomberg.com/features/2025-green-tech-startups-bnef-pioneer-award-winners
2025-03-24,AtmosZero,Company News,Where green technology has to hide behind national security,"Article leads to a 3rd-Party site, please visit the news page instead.",https://www.zeit.de/wirtschaft/2025-03/greentech-usa-donald-trump-klimapolitik-unternehmen/komplettansicht
2025-03-01,AtmosZero,Company News,America’s Top GreenTech Companies of 2025,"Article leads to a 3rd-Party site, please visit the news page instead.",https://time.com/collection/americas-top-greentech-companies-of-2025/
2025-02-19,AtmosZero,Company News,"AtmosZero launches electric Boiler 2.0, and New Belgium Brewing is first in line","Article leads to a 3rd-Party site, please visit the news page instead.",https://www.craftbrewingbusiness.com/equipment-systems/atmoszero-launches-electric-boiler-2-0-and-new-belgium-brewing-is-first-in-line/
2025-02-13,AtmosZero,Company News,AtmosZero kicks off year with first commercial-scaled boiler,"Article leads to a 3rd-Party site, please visit the news page instead.",https://bizwest.com/2025/02/13/atmoszero-kicks-off-year-with-first-commercial-scaled-boiler/
2025-08-27,AtmosZero,Company News,AtmosZero Appoints Dan Leff as Executive Chair of Board of Directors,"LOVELAND, Colo., August 27, 2025 – AtmosZero, the company on a mission to electrify steam, announced today that it has appointed Dan Leff as the executive chair of its six-person Board of Directors. Leff brings extensive leadership experience in the energy and climate technology sectors including building and leading companies focused on industrial automation and manufacturing that will help AtmosZero reach commercialization and expand its global reach.",https://atmoszero.energy/press-release/atmoszero-appoints-dan-leff-as-executive-chair-of-board-of-directors/
