PublishDate,Source,Type,Title,Summary,Link
2025-09-20,RefIndustry,Industry News,Asia Air Conditioner Market to Reach USD 150.64 Billion by 2033,"The Asia Air Conditioner (AC) Market is projected to grow from USD 93.59 billion in 2024 to USD 150.64 billion by 2033, registering a compound annual growth rate (CAGR) of 5.43%, according to a ne",https://refindustry.com/news/market-research/asia-air-conditioner-market-to-reach-usd-150-64-billion-by-2033
2025-09-19,RefIndustry,Industry News,Airedale by Modine launches 2MW Turbocor chiller for global data center market,"Airedale by Modine has announced the launch of TurboChill DCS, a 2MW chiller designed specifically for colocation and hyperscale data centers. The new model is part of Airedale’s DCS range and will",https://refindustry.com/news/new-items/airedale-by-modine-launches-2mw-turbocor-chiller-for-global-data-center-market
2025-09-19,RefIndustry,Industry News,MSA Safety launches ALTAIR io 6 Multigas Detector with cellular connectivity,"MSA Safety, Inc. has introduced the ALTAIR io 6 Multigas Detector at the 2025 National Safety Congress & Expo in Denver, Colorado. The new detector expands the company’s Connected Work Platform",https://refindustry.com/news/new-items/msa-safety-launches-altair-io-6-multigas-detector-with-cellular-connectivity
2025-09-19,RefIndustry,Industry News,Emergent Cold LatAm acquires Brazil’s Comfrio to expand logistics network,"Emergent Cold Latin America has completed the acquisition of Comfrio, a Brazilian cold storage and logistics provider, significantly expanding its operations in the country. With this transaction, Eme",https://refindustry.com/news/cold-chain/emergent-cold-latam-acquires-brazil-s-comfrio-to-expand-logistics-network
2025-09-19,RefIndustry,Industry News,Sanhua Launches BPHE Explorer for Efficient Heat Exchanger Selection,"Sanhua has introduced the BPHE Explorer, a new software tool designed to simplify and enhance the selection process for its brazed plate heat exchangers (BPHE). The solution supports a wide range",https://refindustry.com/news/new-items/sanhua-launches-bphe-explorer-for-efficient-heat-exchanger-selection
2025-09-19,RefIndustry,Industry News,Hanon Systems surpasses 1 million R744 electric compressors,"Hanon Systems announced it has surpassed 1 million units in cumulative production of electric compressors using R744 (CO2). The milestone was reached just one and a half years after achieving 500,000",https://refindustry.com/news/market-news/hanon-systems-surpasses-1-million-r744-electric-compressors
2025-09-18,RefIndustry,Industry News,Phononic licenses ACS cooling platform to US-based cold chain start-up,"Phononic has entered into an exclusive cold chain licensing agreement with California-based start-up Peltier Technology, Inc. Under the deal, Peltier will commercialize Phononic’s Active Cooling Sol",https://refindustry.com/news/cold-chain/phononic-licenses-acs-cooling-platform-to-us-based-cold-chain-start-up
2025-09-20,RefIndustry,Industry News,Asia Air Conditioner Market to Reach USD 150.64 Billion by 2033,"The Asia Air Conditioner (AC) Market is projected to grow from USD 93.59 billion in 2024 to USD 150.64 billion by 2033, registering a compound annual growth rate (CAGR) of 5.43%, according to a ne",https://refindustry.com/news/market-research/asia-air-conditioner-market-to-reach-usd-150-64-billion-by-2033
2025-09-19,RefIndustry,Industry News,Airedale by Modine launches 2MW Turbocor chiller for global data center market,"Airedale by Modine has announced the launch of TurboChill DCS, a 2MW chiller designed specifically for colocation and hyperscale data centers. The new model is part of Airedale’s DCS range and will",https://refindustry.com/news/new-items/airedale-by-modine-launches-2mw-turbocor-chiller-for-global-data-center-market
2025-09-19,RefIndustry,Industry News,MSA Safety launches ALTAIR io 6 Multigas Detector with cellular connectivity,"MSA Safety, Inc. has introduced the ALTAIR io 6 Multigas Detector at the 2025 National Safety Congress & Expo in Denver, Colorado. The new detector expands the company’s Connected Work Platform",https://refindustry.com/news/new-items/msa-safety-launches-altair-io-6-multigas-detector-with-cellular-connectivity
2025-09-19,RefIndustry,Industry News,Emergent Cold LatAm acquires Brazil’s Comfrio to expand logistics network,"Emergent Cold Latin America has completed the acquisition of Comfrio, a Brazilian cold storage and logistics provider, significantly expanding its operations in the country. With this transaction, Eme",https://refindustry.com/news/cold-chain/emergent-cold-latam-acquires-brazil-s-comfrio-to-expand-logistics-network
2025-09-19,RefIndustry,Industry News,Sanhua Launches BPHE Explorer for Efficient Heat Exchanger Selection,"Sanhua has introduced the BPHE Explorer, a new software tool designed to simplify and enhance the selection process for its brazed plate heat exchangers (BPHE). The solution supports a wide range",https://refindustry.com/news/new-items/sanhua-launches-bphe-explorer-for-efficient-heat-exchanger-selection
2025-09-19,RefIndustry,Industry News,Hanon Systems surpasses 1 million R744 electric compressors,"Hanon Systems announced it has surpassed 1 million units in cumulative production of electric compressors using R744 (CO2). The milestone was reached just one and a half years after achieving 500,000",https://refindustry.com/news/market-news/hanon-systems-surpasses-1-million-r744-electric-compressors
2025-09-18,RefIndustry,Industry News,Phononic licenses ACS cooling platform to US-based cold chain start-up,"Phononic has entered into an exclusive cold chain licensing agreement with California-based start-up Peltier Technology, Inc. Under the deal, Peltier will commercialize Phononic’s Active Cooling Sol",https://refindustry.com/news/cold-chain/phononic-licenses-acs-cooling-platform-to-us-based-cold-chain-start-up
2025-09-18,RefIndustry,Industry News,Carrier launches TechVantage Ignite to train U.S. HVAC technicians,"Carrier Commercial Service and Automated Logic Field, both part of Carrier Global Corporation, have launched TechVantage Ignite, a new program to train future commercial HVAC technicians and controls",https://refindustry.com/news/market-news/carrier-launches-techvantage-ignite-to-train-u-s-hvac-technicians
2025-09-18,RefIndustry,Industry News,Politecnico di Torino and ATF sign agreement on HVAC/R research and training,"Politecnico di Torino and the Italian Association of Refrigeration Technicians (ATF) have signed a memorandum of understanding aimed at strengthening collaboration in research, training, and innovatio",https://refindustry.com/news/market-news/politecnico-di-torino-and-atf-sign-agreement-on-hvac-r-research-and-training
2025-09-18,RefIndustry,Industry News,"Solid-State Cooling Market to Expand Rapidly Through 2036, Report Finds","The global advanced solid-state cooling market is set for significant growth between 2026 and 2036, according to a new report published by ResearchAndMarkets.com. The study highlights increasing d",https://refindustry.com/news/market-research/solid-state-cooling-market-to-expand-rapidly-through-2036-report-finds
2025-09-17,RefIndustry,Industry News,"XNRGY expands U.S. operations with new 330,000 sq ft facility in Arizona","XNRGY Climate Systems has announced the construction of a new 330,000 sq ft (approx. 30,660 m²) manufacturing facility in Mesa, Arizona. The new site, named Mesa 2, will support the production of XNR",https://refindustry.com/news/market-news/xnrgy-expands-u-s-operations-with-new-330-000-sq-ft-facility-in-arizona
2025-09-17,RefIndustry,Industry News,NCLA Seeks Rehearing in D.C. Circuit Over EPA’s HFC Market Allocation Rule,"The New Civil Liberties Alliance (NCLA) has filed a petition for en banc rehearing in the U.S. Court of Appeals for the D.C. Circuit, challenging the Environmental Protection Agency’s (EPA) regulati",https://refindustry.com/news/market-news/ncla-seeks-rehearing-in-d-c-circuit-over-epa-s-hfc-market-allocation-rule
2025-09-17,RefIndustry,Industry News,Eberspaecher launches propane-based AC systems for buses,Eberspaecher has introduced two roof-mounted air-conditioning systems using propane (R290) for buses. The AC135 and AC138 EVO models are available for both factory installation and retrofitting in,https://refindustry.com/news/new-items/eberspaecher-launches-propane-based-ac-systems-for-buses
2025-09-17,RefIndustry,Industry News,AHRI opens ASEAN regional office in Singapore to expand certification services,"The Air-conditioning, Heating, and Refrigeration Institute (AHRI) has opened a new office in Singapore to support the growing needs of its members and certification program participants across the",https://refindustry.com/news/market-news/ahri-opens-asean-regional-office-in-singapore-to-expand-certification-services
2025-09-17,RefIndustry,Industry News,Vaccine refrigerators market to reach US$ 2.50 billion by 2033,"The global vaccine refrigerators market, valued at US$ 1.29 billion in 2024, is projected to grow to US$ 2.50 billion by 2033, according to DataM Intelligence. The forecast represents a compound a",https://refindustry.com/news/market-research/vaccine-refrigerators-market-to-reach-us-2-50-billion-by-2033
2025-09-17,RefIndustry,Industry News,New Zealand HVAC&R sector gains stronger voice in vocational training,The HVAC&amp;R industry in New Zealand is set to gain greater influence over vocational training and qualifications through its inclusion in the new Industry Skills Board for Electrotechnology and Inf,https://refindustry.com/news/market-news/new-zealand-hvac-r-sector-gains-stronger-voice-in-vocational-training
2025-09-16,RefIndustry,Industry News,International Day for the Preservation of the Ozone Layer: 40 Years from Science to Global Action,"On 16 September, the International Day for the Preservation of the Ozone Layer is observed, established by the UN General Assembly in 1994 to commemorate the signing of the Montreal Protocol on Substa",https://refindustry.com/news/market-news/international-day-for-the-preservation-of-the-ozone-layer-40-years-from-science-to-global-action
2025-09-16,RefIndustry,Industry News,"Mojave's ArctiDry HVAC Units Reach 100,000 Hours with 99.7% Uptime in U.S.","Mojave Energy Systems announced that its ArctiDry HVAC units have surpassed 100,000 cumulative operating hours in commercial installations across the United States, achieving a reported 99.7% uptim",https://refindustry.com/news/market-news/mojave-s-arctidry-hvac-units-reach-100-000-hours-with-99-7-uptime-in-u-s
2025-09-16,RefIndustry,Industry News,Danfoss highlights CO2 compressor technologies for electric buses,"Danfoss has announced a range of thermal management solutions for electric buses, including transcritical CO2 compressors, ahead of Busworld Europe 2025. The company is targeting the growing demand fo",https://refindustry.com/news/new-items/danfoss-highlights-co2-compressor-technologies-for-electric-buses
2025-09-16,RefIndustry,Industry News,IOR opens elections for President-Elect and Trustees,"The UK-based Institute of Refrigeration (IOR) has opened its 2025 elections, inviting eligible members to vote for a new President-Elect and two new Trustees.  Four candidates are standing for the",https://refindustry.com/news/market-news/ior-opens-elections-for-president-elect-and-trustees
2025-09-16,RefIndustry,Industry News,Global HVAC System Market to Reach USD 407.77 Billion by 2030,"The global HVAC system market is projected to grow from USD 299.28 billion in 2025 to USD 407.77 billion by 2030, at a compound annual growth rate (CAGR) of 6.4%, according to a new report by Mark",https://refindustry.com/news/market-research/global-hvac-system-market-to-reach-usd-407-77-billion-by-2030
2025-09-16,RefIndustry,Industry News,Danfoss sells Dutch heat exchanger unit to local experts in Benelux strategy shift,"Danfoss Plate Heat Exchangers has announced the sale of its Dutch subsidiary, SONDEX B.V., to industry professionals Theo Thoen and Hans Ter Velde. The company, based in Purmerend, will now operate un",https://refindustry.com/news/market-news/danfoss-sells-dutch-heat-exchanger-unit-to-local-experts-in-benelux-strategy-shift
2025-09-15,RefIndustry,Industry News,Danfoss introduces hygienic gasketed plate heat exchangers for food and beverage sector,"Danfoss has launched a new range of hygienic gasketed plate heat exchangers designed for processing applications in the food and beverage industry. According to the company, the equipment uses FDA-com",https://refindustry.com/news/new-items/danfoss-introduces-hygienic-gasketed-plate-heat-exchangers-for-food-and-beverage-sector
2025-09-15,RefIndustry,Industry News,Chile launches CO₂ heat pump pilot project for sustainable industrial refrigeration,The Multilateral Fund of the Montreal Protocol has approved a pilot project to introduce transcritical CO₂-based heat pumps in Chile’s industrial refrigeration sector. The initiative aims to reduc,https://refindustry.com/news/market-news/chile-launches-co-heat-pump-pilot-project-for-sustainable-industrial-refrigeration
2025-09-15,RefIndustry,Industry News,Castel introduces 3032 changeover valves with ORS connection,"Castel Srl has expanded its refrigeration and air conditioning portfolio with the 3032 changeover valves for safety valves, now also available with ORS connections. The solution meets the needs of sys",https://refindustry.com/news/new-items/castel-introduces-3032-changeover-valves-with-ors-connection
2025-09-15,RefIndustry,Industry News,Global heat exchanger market to reach USD 33.52 billion by 2030,"The global heat exchanger market is projected to grow from USD 23.95 billion in 2025 to USD 33.52 billion by 2030, according to a new report by MarketsandMarkets. This represents a compound annual",https://refindustry.com/news/market-research/global-heat-exchanger-market-to-reach-usd-33-52-billion-by-2030
2025-09-15,RefIndustry,Industry News,Australia offers mobile access to key RAC Standards for licensed technicians,The Australian Refrigeration Council (ARC) is offering licensed refrigeration and air conditioning (RAC) technicians and businesses mobile-only access to a curated set of industry standards via th,https://refindustry.com/news/market-news/australia-offers-mobile-access-to-key-rac-standards-for-licensed-technicians
2025-09-14,RefIndustry,Industry News,CIBSE announces 2025 Young Engineers Awards shortlist,"The Chartered Institution of Building Services Engineers (CIBSE) has announced the shortlist for the 2025 Young Engineers Awards, which celebrate their 30th anniversary this year. The awards recognise",https://refindustry.com/news/market-news/cibse-announces-2025-young-engineers-awards-shortlist
2025-09-14,RefIndustry,Industry News,Kenya trains RAC instructors on safe use of R290 in split ACs,Kenya has launched a national and regional Training of Trainers (ToT) program focused on climate- and environmentally friendly split air conditioning systems using R290 refrigerant. The sessions w,https://refindustry.com/news/news-events/kenya-trains-rac-instructors-on-safe-use-of-r290-in-split-acs
2025-09-13,RefIndustry,Industry News,UNEP and GlobalABC advance COP30 Buildings and Cooling Pavilion themes,"The Global Alliance for Buildings and Construction (GlobalABC) and the UN Environment Programme (UNEP) Cool Coalition convened the third COP30 Buildings and Cooling Pavilion webinar, offering st",https://refindustry.com/news/news-events/unep-and-globalabc-advance-cop30-buildings-and-cooling-pavilion-themes
2025-09-13,RefIndustry,Industry News,Viet Nam launches Urban Cooling Action Plans in partnership with UNEP and GGGI,"Viet Nam has released a new set of Urban Cooling Action Plans (UCAPs) for pilot cities, marking the conclusion of a multi-year collaboration between the Department of Climate Change (DCC) under the Mi",https://refindustry.com/news/news-events/viet-nam-launches-urban-cooling-action-plans-in-partnership-with-unep-and-gggi
2025-09-12,RefIndustry,Industry News,U.S. Central AC and Heat Pump Shipments Drop 26.8% in July 2025,"According to the Air-Conditioning, Heating, and Refrigeration Institute (AHRI), U.S. shipments of central air conditioners and air-source heat pumps totaled 763,443 units in July 2025, representin",https://refindustry.com/news/market-news/u-s-central-ac-and-heat-pump-shipments-drop-26-8-in-july-2025
2025-09-12,RefIndustry,Industry News,NAVAC launches Smart Probe line for HVAC diagnostics in the US,"NAVAC, a leading US-based supplier of HVAC vacuum pumps and tools, has introduced a new range of Smart Probes designed to enhance field diagnostics for HVAC professionals. The product line include",https://refindustry.com/news/new-items/navac-launches-smart-probe-line-for-hvac-diagnostics-in-the-us
2025-09-12,RefIndustry,Industry News,Trane launches CRAH and fan wall units for European data centre cooling,"Trane, a brand of Trane Technologies, has introduced new air cooling solutions tailored for data centres and mission-critical environments across Europe. The portfolio now includes Computer Room Air H",https://refindustry.com/news/new-items/trane-launches-crah-and-fan-wall-units-for-european-data-centre-cooling
2025-09-12,RefIndustry,Industry News,Shree Refrigerations to Offer Smardt Oil-Free Chillers for Data Centres in India,"Shree Refrigerations Limited (SRL), a supplier of cooling systems to India’s Defence sector, has entered a strategic association with Smardt Chillers Pte Ltd to deliver oil-free chillers for the cou",https://refindustry.com/news/market-news/shree-refrigerations-to-offer-smardt-oil-free-chillers-for-data-centres-in-india
2025-09-12,RefIndustry,Industry News,Eurovent publishes new guidance on AHU controls under revised EPBD,"Eurovent has issued a new Recommendation on air handling unit (AHU) controls in building automation, aimed at supporting compliance with the revised EU Energy Performance of Buildings Directive (E",https://refindustry.com/news/market-news/eurovent-publishes-new-guidance-on-ahu-controls-under-revised-epbd
2025-09-12,RefIndustry,Industry News,Moon-TECH heat pump distillation system approved for technological achievement in China,"Moon-TECH Environmental Technology Co., Ltd., in collaboration with Sinopec Qingdao Refining &amp; Chemical Co., Ltd., Xi’an Jiaotong University, and others, has passed a scientific and technologica",https://refindustry.com/news/market-news/moon-tech-heat-pump-distillation-system-approved-for-technological-achievement-in-china
2025-09-11,RefIndustry,Industry News,G&D Chillers launches ForgeLine HT Series for high-temperature applications,"G&amp;D Chillers, a U.S.-based manufacturer of industrial process cooling systems, has introduced the ForgeLine HT Series, designed for high-temperature, high-demand industrial operations.  The Fo",https://refindustry.com/news/new-items/g-d-chillers-launches-forgeline-ht-series-for-high-temperature-applications
2025-09-11,RefIndustry,Industry News,Embraco presents new scroll compressors and refrigeration solutions at AHR Expo Mexico,"Embraco, a brand of Nidec Global Appliance, will introduce its new scroll compressor portfolio for the first time in North America at AHR Expo Mexico 2025, held from September 23 to 25 at CINTERMEX, M",https://refindustry.com/news/news-events/embraco-presents-new-scroll-compressors-and-refrigeration-solutions-at-ahr-expo-mexico
2025-09-11,RefIndustry,Industry News,"Hudson Technologies and DCSEU launch refrigerant recovery pilot in Washington, DC","Hudson Technologies, Inc. and the DC Sustainable Energy Utility (DCSEU) have launched a refrigerant recovery and reclamation (RR&amp;R) pilot aimed at reducing greenhouse gas (GHG) emissions in Wa",https://refindustry.com/news/market-news/hudson-technologies-and-dcseu-launch-refrigerant-recovery-pilot-in-washington-dc
2025-09-11,RefIndustry,Industry News,Global inverter compressor market to reach USD 11.5 billion by 2032,"The global inverter compressor technology market is expected to grow from USD 7.3 billion in 2024 to USD 11.5 billion by 2032, according to a new report by Research and Markets. This represents a",https://refindustry.com/news/market-research/global-inverter-compressor-market-to-reach-usd-11-5-billion-by-2032
2025-09-11,RefIndustry,Industry News,ebm‑papst launches training programs for 76 new recruits across Germany,"On September 1, 2025, fan manufacturer ebm‑papst began training 76 new trainees and dual students at its locations in Mulfingen, Landshut, and St. Georgen, Germany. The company offers 28 different a",https://refindustry.com/news/market-news/ebm-papst-launches-training-programs-for-76-new-recruits-across-germany
2025-09-11,RefIndustry,Industry News,South African Minister Highlights Cold Chain Priorities at GCCA Africa Conference,"South Africa’s Minister of Agriculture, John Steenhuisen, addressed the GCCA Africa Cold Chain Conference on August 21, 2025, in Durban, emphasizing the importance of cold chain infrastructure for t",https://refindustry.com/news/cold-chain/south-african-minister-highlights-cold-chain-priorities-at-gcca-africa-conference
2025-09-19,CoolingPost-World,Industry News,Brunei ratifies Kigali Amendment,BRUNEI DARUSSALAM: Brunei Darussalam has become the latest country to have officially ratify the Kigali Amendment to phase down HFCs.,https://www.coolingpost.com/world-news/brunei-ratifies-kigali-amendment/
2025-09-19,CoolingPost-World,Industry News,Johnson Controls awarded $156m US defence contract,USA: Johnson Controls has been awarded a $156m contract to supply chillers and related equipment to the US Department of Defense.,https://www.coolingpost.com/world-news/johnson-controls-awarded-156m-us-defence-contract/
2025-09-18,CoolingPost-World,Industry News,Hanon passes 1 million eCompressor milestone,"SOUTH KOREA: Hanon Systems, supplier of components for Volkswagen Group’s MEB platform for electric cars, has passed the production landmark of 1 million electric CO2 compressors.",https://www.coolingpost.com/world-news/hanon-passes-1-million-ecompressor-milestone/
2025-09-17,CoolingPost-World,Industry News,Concern over high AC refill rates in India,INDIA: A new report into India’s rapidly growing residential air conditioning market and its potential effects on global warming has revealed refill rates far higher than the global norm.,https://www.coolingpost.com/world-news/concern-over-high-ac-refill-rates-in-india/
2025-09-16,CoolingPost-World,Industry News,Guterres urges full implementation of Kigali,USA: United Nations secretary general António Guterres has urged governments to fully ratify and implement the Kigali Amendment to phase down HFCs.,https://www.coolingpost.com/world-news/guterres-urges-full-implementation-of-kigali/
2025-09-16,CoolingPost-World,Industry News,Man sentenced for smuggling R22,"USA: A man who confessed to smuggling five cylinders of illegal R22 refrigerant into the USA has been sentenced to three-years' probation, including 15 days’ time served.",https://www.coolingpost.com/world-news/man-sentenced-for-smuggling-r22/
2025-09-15,CoolingPost-World,Industry News,Austria wins gold at EuroSkills,"DENMARK: Austrian Jonas Danninger, an employee of Hauser GmbH, won the Refrigeration and Air Conditioning gold medal at last week’s EuroSkills competition in Herning, Denmark.",https://www.coolingpost.com/world-news/austria-wins-gold-at-euroskills/
2025-09-14,CoolingPost-World,Industry News,Carrier completes 10-14ton RTU challenge,USA: Carrier has become the first manufacturer to complete the US Department of Energy's Commercial Building HVAC Technology Challenge laboratory validation in the 10-14ton rooftop heat pump category.,https://www.coolingpost.com/world-news/carrier-completes-10-14ton-rtu-challenge/
2025-09-14,CoolingPost-World,Industry News,Danfoss sells Dutch subsidiary Sondex BV,"DENMARK/NETHERLANDS: Danfoss Plate Heat Exchangers has sold its Dutch heat exchanger subsidiary, Sondex BV, to heat exchanger experts Theo Thoen and Hans Ter Velde.",https://www.coolingpost.com/world-news/danfoss-sells-dutch-subsidiary-sondex-bv/
2025-09-12,CoolingPost-World,Industry News,Saudi Arabia joins Kigali pledge,SAUDI ARABIA: The Kingdom of Saudi Arabia has become the latest country to have officially accepted the Kigali Amendment to phase down HFCs.,https://www.coolingpost.com/world-news/saudi-arabia-joins-kigali-pledge/
2025-09-11,CoolingPost-World,Industry News,Worker dies in refrigerant plant leak,"INDIA: One person died and 12 were reportedly hospitalised on Wednesday (10 September) after a leak in a pipeline at the Gujarat Fluorochemicals refrigerant plant in Ranjitnagar, India.",https://www.coolingpost.com/world-news/worker-dies-in-refrigerant-plant-leak/
2025-09-11,CoolingPost-World,Industry News,Smardt Chillers in Indian data centre deal,"CANADA/INDIA: Montreal-based Smardt Chillers is to supply its oil-free centrifugal chillers to Indian company Shree Refrigerations, a leading player in cooling solutions serving the defence sector.",https://www.coolingpost.com/world-news/smardt-chillers-in-indian-data-centre-deal/
2025-09-10,CoolingPost-World,Industry News,Trane sounds the NYSE opening bell,USA: Trane Technologies has rung the New York Stock Exchange opening bell to celebrate its fifth year as an HVACR-focused company.,https://www.coolingpost.com/world-news/trane-sounds-the-nyse-opening-bell/
2025-09-10,CoolingPost-World,Industry News,Leak testing with oxygen caused heat pump blast,POLAND: Authorities in Opole have concluded that the heat pump explosion in Chrząstowice that killed two people last year was caused by using oxygen to carry out pressure tests.,https://www.coolingpost.com/world-news/leak-testing-with-oxygen-caused-heat-pump-blast/
