PublishDate,Source,Type,Title,Summary,Link
2025-09-20,JARN News,Industry News,MANAGEMENT COMMITTEE – Nomination for 2026-2028 Vice-President,"In accordance with the BCIA Articles of Association, at their meeting held on Wednesday 10th September 2025 the Management Committee proposed Ron Purcell as their nomination for the position of BCIA Vice-President, which will become vacant from 1st March 2026.",https://www.ejarn.com/article/detail/90470
2025-09-20,JARN News,Industry News,Call for two new members of the Management Committee,"In accordance with the BCIA Ltd Articles of Association (clause 32.1) Committee members serve for a fixed term of three years with the two longest serving members stepping down each year.  Jason Harper will stand down from the Committee, whilst Ron Purcell has been nominated as the Management Committee’s Vice President candidate. Graeme Rees, who has completed six-years on the Presidential team, will also retire from his role as Immediate Past President.",https://www.ejarn.com/article/detail/90469
2025-09-20,JARN News,Industry News,The Complete Guide to Energy-Efficient Heating for Commercial Buildings,"Energy efficiency is crucial for a commercial building like an office block. An energy-efficient building causes multiple benefits, including reduced operating costs and an improved environmental footprint.",https://www.ejarn.com/article/detail/90468
2025-09-20,JARN News,Industry News,Oakland International Enjoying Growth In Yorkshire,"The opening of Oakland International’s Knottingley site in West Yorkshire in 2024 expanded the company’s national footprint offering over 161,000 sq. ft of high-specification, multi-temperature storage designed to fuel future sector growth.",https://www.ejarn.com/article/detail/90467
2025-09-20,JARN News,Industry News,Bidfresh Relocates Daily Fish To New Enfield Depot To Improve Service In London,"Specialist fresh produce supplier, Bidfresh, has moved Daily Fish from its Kings Cross base in North London to a new 24,298 sq ft state-of-the-art depot in Enfield.",https://www.ejarn.com/article/detail/90466
2025-09-20,JARN News,Industry News,BESA launches vent hygiene competence toolkit,The Building Engineering Services Association (BESA) has launched the second in its planned series of practical guides to help the building services industry demonstrate its technical competence and ability to comply with increasingly stringent building safety legislation and standards.,https://www.ejarn.com/article/detail/90465
2025-09-19,JARN News,Industry News,Headline News Volume 796,"During a recent visit to Haier’s manufacturing facility in Jakarta, JARN was welcomed by Factory Director Mr. Gao Junyi and gained valuable insights into the company’s localized operations in Southeast Asia. Established in 2013 after acquiring Sanyo’s regional business, the factory began with refrigerators and later expanded to air conditioners and televisions—demonstrating Haier’s responsiveness to Indonesia’s evolving market needs.",https://www.ejarn.com/article/detail/90463
2025-09-19,JARN News,Industry News,"Haier: Innovation, partnership and customer engagement were at the heart of the Frigro Installer Event 2025.","On 5 September, our long-standing distribution partner Frigro hosted its highly anticipated end of summer event at their warehouse in Belgium – and the day was a resounding success. With more than 500 key customers, installers, and industry professionals in attendance, the event created the perfect stage for networking, discovery, and lively exchanges within the HVAC community.",https://www.ejarn.com/article/detail/90462
2025-09-19,JARN News,Industry News,The Power of Solutions: Early-bird booking now open for ISH 2027,"The HVAC sector is undergoing profound transformation: energy and climate issues, digitalisation and shifting market conditions are presenting companies with significant challenges. As the industry’s leading platform, ISH continuously accompanies this change and, with its next edition from 15 to 19 March 2027 in Frankfurt am Main, will once again place practical solutions and innovative concepts centre stage. Under the new claim “The Power of Solutions”, it highlights answers to the pressing questions of our time and underscores the importance of taking a proactive approach.",https://www.ejarn.com/article/detail/90461
2025-09-19,JARN News,Industry News,Daikin | Heat Recovery in chillers: overview and regulatory framework [1/3],"Heat recovery systems are designed to provide cooling while simultaneously recovering waste heat for reuse. Unlike conventional air conditioning systems, where chillers release heat into the atmosphere (through air or geothermal sources), heat recovery systems capture this energy and reuse it. The recovered heat can then be used for various applications, such as producing domestic hot water, supporting space heating, or meeting other thermal demands within a building or industrial facility.",https://www.ejarn.com/article/detail/90460
2025-09-19,JARN News,Industry News,Combat: How to Maintain Your Industrial Heating System Year-Round,"Your industrial heating system works hard behind the scenes, day in and day out. Whether it’s keeping your team warm through winter or maintaining consistent temperatures year-round, it’s a core part of your business’ daily operations. But like any piece of equipment, it needs regular care to keep doing its job properly.",https://www.ejarn.com/article/detail/90459
2025-09-19,JARN News,Industry News,Combat: How Radiant Heating Reduces Energy Bills in Retail,"In the ever-competitive retail industry, managing operational costs is a constant challenge. Among these costs, energy consumption for heating stands as a significant burden. Furthermore, a study completed on the review on buildings energy information demonstrated that HVAC accounts for 38% of buildings consumption. From this, it is easy to recognise that retailers will be looking for innovative ways to cut costs with their heating systems. That’s where radiant heating comes in.",https://www.ejarn.com/article/detail/90458
2025-09-19,JARN News,Industry News,Sanhua: BPHE SELECTOR - EXPLORER,"We’re excited to announce the launch of Sanhua BPHE Explorer, an advanced software solution for selecting Sanhua Brazed Plate Heat Exchangers with precision and ease.",https://www.ejarn.com/article/detail/90457
2025-09-19,JARN News,Industry News,Swegon: A Wooden Air Handling Unit – Redefining the Industry?,"Considering todays many challenging sustainability targets, it is no surprise that people wonder why certain products look or work the way they do. However, when alternative solutions are explored, factors such as functionality or lifespan, often turn out to be significant showstoppers. What if someone refused to let these obstacles stifle their curiosity, and instead created a product that took on a completely new “costume”? Our expert, Martin Ottersten, Research & Innovation Development Engineer, presents a pioneering testing in this blog post.",https://www.ejarn.com/article/detail/90456
2025-09-19,JARN News,Industry News,Weil-McLain Introduces B100 Compatibility for Residential Oil Boilers,"– September 17, 2025 – Paving the way for a more climate conscious future, hydronic comfort heating solutions leader Weil-McLain®opens in a new tab has announced that its Ultra® Oilopens in a new tab, WGOopens in a new tab, WTGOopens in a new tab and SGOopens in a new tab residential oil boilers are now certified for use with biofuel blends up to 100% (B100). This achievement has been made possible through collaboration with industry leaders R.W. Beckett and Carlin Combustion, as Weil-McLain validates the adaptability of their burners to the elevated blend of biofuel when combined with its popular oil-fired boiler product lines. This advancement underscores Weil-McLain’s commitment to delivering sustainable heating options and driving environmental progress in the industry.",https://www.ejarn.com/article/detail/90455
2025-09-19,JARN News,Industry News,Panasonic Air Conditioning Transforms Surrey Home with Year-Round Comfort,", September 2025 – An extended 30-year-old five-bedroom family home in Surrey has recently been upgraded with Panasonic’s highly efficient Etherea with compact outdoor Air Conditioning system, featuring nanoeTM X technology. The installation has solved long-standing heating and cooling challenges, while improving indoor air quality and comfort throughout the year.",https://www.ejarn.com/article/detail/90454
2025-09-19,JARN News,Industry News,Tribute to Eurovent Legends at the Summit,"Join us as we celebrate industry pioneers at the Legends of Eurovent event in Prague during the 2025 EUROVENTSUMMIT. Enjoy inspiring stories, lifelong recognition, and networking in a historic Czech brewery.",https://www.ejarn.com/article/detail/90453
2025-09-19,JARN News,Industry News,Europe 2025 heatwaves: demand for AC surges as heat-related deaths triple,"Recent analysis from the World Meteorological Organization, the World Resources Institute and the Imperial College London take stock of this summer’s heatwaves in Europe.",https://www.ejarn.com/article/detail/90452
2025-09-19,JARN News,Industry News,Viessmann | NordBau 2025: Future-proof energy systems for modernization and new construction,"Viessmann Climate Solutions will be presenting its latest heating and air conditioning solutions at NordBau in Neumünster from September 10 to 14. Visitors will find the company in Hall 7 at Booth 7131, where it will be showcasing future-proof systems comprising heat pumps, electricity storage units, and photovoltaics.",https://www.ejarn.com/article/detail/90451
2025-09-19,JARN News,Industry News,Castell Howell Extends Longstanding Collaboration with Carrier Transicold with 20 New Supra HE 13 MT Units,"Castell Howell has continued its 33-year collaboration with Carrier Transicold with the delivery of 20 new Supra® High Efficiency (HE) 13 Multi-Temperature (MT) units – the first multi-temperature models of the system to be deployed on UK roads. Based in Carmarthenshire, the food wholesaler continues to lead in fleet innovation, consistently selecting advanced solutions from Carrier Transicold’s portfolio to power its extensive range of temperature-controlled trucks and trailers. Carrier Transicold is a part of Carrier Global Corporation (NYSE: CARR), global leader in intelligent climate and energy solutions.",https://www.ejarn.com/article/detail/90450
2025-09-19,JARN News,Industry News,Carrier Powering the Future of Energy,"Sept. 17, 2025 /PRNewswire/ -- Carrier Global Corporation (NYSE: CARR), global leader in intelligent climate and energy solutions, has begun its first field trials of battery-enabled HVAC systems to test how they can store and shift energy when the grid needs it most.",https://www.ejarn.com/article/detail/90449
2025-09-19,JARN News,Industry News,Carrier Launches TechVantage Ignite to Develop Next-Generation HVAC Technicians and Controls Engineers,"Carrier Commercial Service and Automated Logic Field, part of Carrier Global Corporation (NYSE: CARR), global leader in intelligent climate and energy solutions, have launched the first cohorts of TechVantage Ignite, a program to develop the next generation of commercial HVAC technicians and controls engineers.",https://www.ejarn.com/article/detail/90448
2025-09-23,Contractor Mag - Management,Industry News,"Tariffs, Trade and Construction Contractors","Tariff policies will have wide-ranging cost implications for construction companies beyond the price of overseas building materials. Historically, global tariffs have also raised prices on domestically made materials.",https://www.contractormag.com/management/best-practices/article/55318392/tariffs-trade-and-construction-contractors
2025-09-23,Contractor Mag - Management,Industry News,6 Unsolvable Plumbing Problems (and Why They Don’t Matter),"Every plumbing company has problems. Some are internal and largely in the control of the owner. Others are external and owners often feel helpless in the face of them. In truth, you have more control than you think. It all depends on your approach. Here are six common problems that most plumbers consider unsolvable, but are not even problems.",https://www.contractormag.com/management/marketing/article/55318366/6-unsolvable-plumbing-problems-and-why-they-dont-matter
2025-09-19,Contractor Mag - Management,Industry News,The Three Keys to Lasting Success,Who’s really running your business and what should you focus on? How should you think about finances? The answers to these fundamental questions are often more straightforward than we make them out to be.,https://www.contractormag.com/management/best-practices/article/55317590/the-three-keys-to-lasting-success
2025-09-23,Contractor Mag - Hydronics,Industry News,Electrical Infrastructure In Boiler Rooms: A Mechanical Contractor’s Guide,"Boiler rooms serve as hubs that house electrical and mechanical systems, requiring careful infrastructure design and planning. The right setup ensures that these systems are able to operate safely and reliably to reduce the risk of fires and other hazards while also minimizing downtime.",https://www.contractormag.com/hydronics/article/55318261/electrical-infrastructure-in-boiler-rooms-a-mechanical-contractors-guide
2025-09-20,Contractor Mag - Hydronics,Industry News,"Weekly Product Gallery: Oatey, A. O. Smith, Buyers Products, Streamlight, RefrigiWear, Trafag","Kelly L. Faloonis a contributing editor and writer toContractor,Contracting Businessmagazine andHPAC Engineeringand principal of Faloon Editorial Services. The former editor ofPlumbing & Mechanicalmagazine, Faloon has more than 26 years of experience in the plumbing and heating industry and more than 35 years in B2B publishing. She started a freelance writing and editing business in 2017, where she has a varied clientele.",https://www.contractormag.com/media-galleries/media-gallery/55317919/weekly-product-gallery-oatey-a-o-smith-buyers-products-streamlight-refrigiwear-trafag
2025-09-19,Contractor Mag - Technology,Industry News,ServiceTitan Brings AI Automation to the Trades With Atlas,"LOS ANGELES, CA — ServiceTitan (Nasdaq: TTAN) has introduced a new suite of AI-powered tools that help contractors automate their entire back office—from the first call to the final invoice. The company also unveiled Atlas, a next-generation AI sidekick built into ServiceTitan that can act, decide, and adapt like a member of the team.",https://www.contractormag.com/technology/news/55317927/servicetitan-brings-ai-automation-to-the-trades-with-atlas
2025-09-20,Contractor Mag - Tools,Industry News,"Weekly Product Gallery: Oatey, A. O. Smith, Buyers Products, Streamlight, RefrigiWear, Trafag","Kelly L. Faloonis a contributing editor and writer toContractor,Contracting Businessmagazine andHPAC Engineeringand principal of Faloon Editorial Services. The former editor ofPlumbing & Mechanicalmagazine, Faloon has more than 26 years of experience in the plumbing and heating industry and more than 35 years in B2B publishing. She started a freelance writing and editing business in 2017, where she has a varied clientele.",https://www.contractormag.com/media-galleries/media-gallery/55317919/weekly-product-gallery-oatey-a-o-smith-buyers-products-streamlight-refrigiwear-trafag
2025-09-22,ACHR-Breaking News,Industry News,BNP Media Unveils IgniteDemand: A Data-Driven Platform Redefining B2B Demand Generation,IgniteDemand moves beyond traditional lead-gen programs that delay delivery or lack actionable insight.,https://www.achrnews.com/articles/165277-bnp-media-unveils-ignitedemand-a-data-driven-platform-redefining-b2b-demand-generation
2025-09-22,ACHR-Breaking News,Industry News,Forbes Names Johnson Controls One of America’s Best Employers for Company Culture,"2025 marks the first year of the list, which is based on an independent survey of over 218,000 U.S.-based employees working for companies employing at least 1,000 people within the U.S.",https://www.achrnews.com/articles/165274-forbes-names-johnson-controls-one-of-americas-best-employers-for-company-culture
2025-09-20,ACHR-Breaking News,Industry News,Fujitsu General Starts Anew as a Member of the Paloma Rheem Group,"Fujitsu General has completed a series of procedures following the public tender offer for common shares by Paloma Rheem Holdings Co., Ltd., — becoming a member of the Paloma Rheem HD Group.",https://www.achrnews.com/articles/165273-fujitsu-general-starts-anew-as-a-member-of-the-paloma-rheem-group
2025-09-19,ACHR-Breaking News,Industry News,ServiceTitan Introducing the Next Evolution of AI at Pantheon 2025 Keynote Sessions,"Atlas acts like the ultimate power user of ServiceTitan, and over time will have the capabilities to handle many of the tasks, insights, and decisions a business owner or team member could make.",https://www.achrnews.com/articles/165267-servicetitan-introducing-the-next-evolution-of-ai-at-pantheon-2025-keynote-sessions
2025-09-19,Fleet Owner,Industry News,Trackers vs. loggers: Which are right for your operation?,Cold chain logistics and management is a case study in high stakes.,https://www.fleetowner.com/refrigerated-transporter/reefer-operations/article/55317565/trackers-vs-loggers-which-are-right-for-your-operation
2025-09-22,DOE - Press Release,Industry News,Projects at LM Sites Aim to Improve Soil Moisture Monitoring While Lowering Costs,Office of Legacy Management (LM) scientists are investigating groundbreaking options for the future management of disposal sites containing uranium mill tailings.,https://www.energy.gov/lm/articles/projects-lm-sites-aim-improve-soil-moisture-monitoring-while-lowering-costs
2025-09-22,IEA News,Industry News,Southeast Asia can harness vast renewable resources to meet fast-growing electricity demand,"Southeast Asia’s electricity demand is rising at one of the fastest rates in the world, underscoring the need for countries to diversify energy supplies and reinforce grid infrastructure. A new IEA report released today highlights how countries in the region can leverage their abundant renewable resources, notably wind and solar PV, to meet soaring demand and achieve their energy priorities.",https://www.iea.org/news/southeast-asia-can-harness-vast-renewable-resources-to-meet-fast-growing-electricity-demand
2025-09-22,Hussmann,Company News,Hussmann Unveils New Reach-In Merchandiser with Air-Cooled Microblock™ Technology,"Hussmann, a Panasonic company, has launched its newest merchandiser complete with Microblock™ Technology. The RLN-A and RMN-A offer refrigerated retail solutions for both medium and low temperature applications. The display case features an all-in-one, top-mounted refrigeration system to simplify the installation and service process.",https://www.hussmann.com/news/hussmann-unveils-new-reach-in-merchandiser-with-air-cooled-microblock-technology
2025-09-19,Panasonic-HVAC,Company News,Structure of the Sustainable & Climate Tech Group in Connection with Panasonic Group Structure Transition Effective,"The Heating & Ventilation A/C Company and the Cold Chain Solutions Company of Panasonic Corporation will be reorganized and established as a new operating company ""Panasonic HVAC & CC Co., Ltd."" effective April 1, 2026, as announced by Panasonic Holdings Corporation on July 30, 2025. The new operating company will have a structure where the current two internal divisional companies and five affiliated companies under Panasonic Corporation's Sustainable & Climate Tech Group are reorganized into three companies. Regarding business operations, Panasonic HVAC & CC Co., Ltd. will take the lead and operate the three companies as an integrated group. Details are as follows:",https://www.panasonic.com/global/hvac/press/data/2025/09/en250919.html
2025-09-22,Secop,Company News,Secop and Official Distributor Prima Prospek at RHVAC Indonesia 2025,"Secop, a global leader in refrigeration technologies, announces its participation at RHVAC Indonesia 2025 together with its local partner Prima Prospek, the official distributor in the region. From September 24 to 26, 2025, at the Jakarta International Expo, booth AQ-01, Secop will showcase its latest sustainable and efficient refrigeration solutions.",https://www.secop.com/updates/news/secop-and-official-distributor-prima-prospek-at-rhvac-indonesia-2025
2025-09-22,Tive,Company News,"Tive Named to FreightWaves ""2026 FreightTech 100"" Top Innovators List","Link leads to a 3rd party site, please visit the news page instead.",https://www.freightwaves.com/news/freightwaves-announces-2026-freighttech-100-companies
2025-09-19,Rees Scientific,Company News,Why IVF Labs Need Environmental Monitoring Systems to Protect Patients and Compliance,"IVF labs today face higher expectations than ever before. More patients are turning to assisted reproductive technologies, and with that growth comes increased scrutiny from regulators, accrediting bodies, and patients themselves. Every embryo and sample entrusted to your lab represents a family’s future, and maintaining confidence means ensuring nothing is left to chance.",https://reesscientific.com/blog/why-ivf-labs-need-environmental-monitoring
