PublishDate,Source,Type,Title,Summary,Link
2025-09-19,CoolingPost-UK,Industry News,IOR president is “Local Hero”,UK: Institute of Refrigeration president Lisa-Jayne Cook was amongst the winners last night at the Top 100 Most Influential Women in Construction Awards 2025.,https://www.coolingpost.com/uk-news/ior-president-is-local-hero/
2025-09-18,CoolingPost-UK,Industry News,Taking heat pumps to Holyrood,UK: Working heat pumps were recently placed before the Scottish parliament to raise awareness of the technology and its potential role in decarbonising Scotland’s heating.,https://www.coolingpost.com/uk-news/taking-heat-pumps-to-holyrood/
2025-09-17,CoolingPost-UK,Industry News,Industry backs mandatory alternative refrigerants training,"UK: As the RACHP Industry prepares for the revision of the F-gas regulations, the industry has shown overwhelming backing for the introduction of mandatory certified…",https://www.coolingpost.com/uk-news/industry-backs-mandatory-alternative-refrigerants-training/
2025-09-15,CoolingPost-UK,Industry News,Former Hawco MD to head K2 Engineering,"UK: Martin Butler, former managing director of Hawco, has joined Surrey-based refrigeration consultants K2 Engineering (Cooling) as MD.",https://www.coolingpost.com/uk-news/former-hawco-md-to-head-k2-engineering/
2025-09-15,CoolingPost-UK,Industry News,Langford appointed Panasonic UK country manager,UK: Mick Langford has been appointed UK country manager for Panasonic’s heating and cooling division. He replaces John Kellett who has stepped down from the role for personal reasons.,https://www.coolingpost.com/uk-news/langford-appointed-panasonic-uk-country-manager/
2025-09-15,CoolingPost-UK,Industry News,Paul Singh to stand for IOR president,"UK: Paul Singh, owner of the Chillair (UK) Training Academy, has joined  the race to be elected as the next president of the Institute of Refrigeration (IOR).",https://www.coolingpost.com/uk-news/paul-singh-to-stand-for-ior-president/
2025-09-14,CoolingPost-UK,Industry News,Industry recognition for Matt Morton,"UK: Matt Morton, chairman of Durham-based EJM Engineered Systems, has received the Institute of Refrigeration’s Northern Branch Lifetime Achievement Award for his outstanding contribution to the industry.",https://www.coolingpost.com/uk-news/industry-recognition-for-matt-morton/
2025-09-11,CoolingPost-UK,Industry News,CTC partners with The Merchant’s Choice group,"UK: Go Geothermal, the UK distributor of CTC heat pumps, has announced a partnership with The Merchant’s Choice, a specialist buying group for plumbers’ merchants.",https://www.coolingpost.com/uk-news/ctc-partners-with-the-merchants-choice-group/
2025-09-10,CoolingPost-UK,Industry News,Improving service across London and the SE,UK: Wolseley brands Pipe Centre and Climate Centre have unveiled a new logistics model to improve customer service across London and the SE.,https://www.coolingpost.com/uk-news/improving-service-across-london-and-the-se/
2025-09-16,CoolingPost-Products,Industry News,Danfoss adds hygienic heat exchangers,DENMARK: Danfoss has launched a range of hygienic gasketed plate heat exchangers for a variety of applications in the food and beverage industry.,https://www.coolingpost.com/products/danfoss-adds-hygienic-heat-exchangers/
2025-09-12,CoolingPost-Products,Industry News,Haier R32 VRF for the European market,ITALY: Haier HVAC Solutions Europe has announced a new R32 VRF system specifically tailored for the European market.,https://www.coolingpost.com/products/haier-r32-vrf-for-the-european-market/
2025-09-10,CoolingPost-Products,Industry News,Sanhua adds new sight glasses,SPAIN: Sanhua has introduced a new range of sight glasses engineered for high-pressure refrigerants.,https://www.coolingpost.com/products/sanhua-adds-new-sight-glasses/
2025-09-18,CoolingPost-T&E,Industry News,Tickets now available for IOR dinner,"UK: Tickets are now available for the annual Institute of Refrigeration dinner, which returns to the Hilton London Bankside hotel on 12 February 2026.",https://www.coolingpost.com/training/tickets-now-available-for-ior-dinner/
2025-09-15,CoolingPost-T&E,Industry News,Lawton Tubes opens training studio,"UK: A new training studio to help inspire the next generation of air conditioning engineers, plumbers, and medical gas technicians has been announced by copper tube supplier Lawton Tubes.",https://www.coolingpost.com/training/lawton-tubes-opens-training-studio/
2025-09-19,Natural Refrigerants,Industry News,"Italy’s DEM Supermarkets Installing CO2 Refrigeration Systems to Cut Greenhouse Gas Emissions, Says Arneg",The company is installing CO2 refrigeration systems in all of its new ..,https://naturalrefrigerants.com/news/italys-dem-supermarkets-installing-co2-refrigeration-systems-to-cut-greenhouse-gas-emissions-says-arneg/
2025-09-18,Natural Refrigerants,Industry News,Canadian Researchers Find More Atmospheric TFA in the Summer and in Urban Areas,"Using a novel air sampler, the study revealed trends consistent with the ..",https://naturalrefrigerants.com/news/canadian-researchers-find-more-atmospheric-tfa-in-the-summer-and-in-urban-areas/
2025-09-18,Natural Refrigerants,Industry News,"IAA Mobility 2025: Automakers Are Showing ‘High Interest’ in R290 for Electric Vehicles, Says ZF","Potential U.S. regulatory updates are playing a major role in driving interest, ..",https://naturalrefrigerants.com/news/iaa-mobility-2025-automakers-are-showing-high-interest-in-r290-for-electric-vehicles-says-zf/
2025-09-17,Natural Refrigerants,Industry News,"More Regulation of F-Gases May Be Needed Because of TFA Link, Says ECHA’s Updated PFAS Proposal","Existing legislation, which focuses on GWP, does not address the risks associated ..",https://naturalrefrigerants.com/news/more-regulation-of-f-gases-may-be-needed-because-of-tfa-link-says-echas-updated-pfas-proposal/
2025-09-17,Natural Refrigerants,Industry News,Adaptation 2025: Pressure Exchanger Boosts Efficiency of Transcritical CO2 System by 15% in Hungarian Hypermarket,The technology from U.S. manufacturer Energy Recovery can also support reliable system ..,https://naturalrefrigerants.com/news/adaptation-2025-pressure-exchanger-boosts-efficiency-of-transcritical-co2-system-by-15-in-hungarian-hypermarket/
2025-09-16,Natural Refrigerants,Industry News,ECHA’s Updated PFAS Proposal Retains Most Restrictions on PFAS Refrigerants,Many HVAC&R applications keep their original exemption period though MAC is given ..,https://naturalrefrigerants.com/news/echas-updated-pfas-proposal-retains-most-restrictions-on-pfas-refrigerants/
2025-09-16,Natural Refrigerants,Industry News,Hanon Systems Has Built More Than 1 Million CO2 E-Compressors for Electric Vehicles,"The e-compressors are supplied to Volkswagen, which uses them in EVs built ..",https://naturalrefrigerants.com/news/hanon-systems-has-built-more-than-1-million-co2-ecompressors-for-electric-vehicles/
2025-09-16,Natural Refrigerants,Industry News,"Johnson Controls’ 42MW Ammonia Heat Pump System to Deliver District Heating to 15,000 Homes in Zurich","The units, part of a local utility project, will recover heat from ..",https://naturalrefrigerants.com/news/johnson-controls-42mw-ammonia-heat-pump-system-to-deliver-district-heating-to-15000-homes-in-zurich/
2025-09-15,Natural Refrigerants,Industry News,The Expert Opinion: Why the AIM Act Isn’t Going Anywhere and What That Means for Natural Refrigerant Planning,"Amrit Robbins, CEO and Co-founder of Axiom Cloud, on how AIM Act ..",https://naturalrefrigerants.com/news/the-expert-opinion-why-the-aim-act-isnt-going-anywhere-and-what-that-means-for-natural-refrigerant-planning/
2025-09-12,Natural Refrigerants,Industry News,California Seeks Proposals for Risk Assessment of Residential A3 Heat Pumps,"Coordinated by NASRC, the FRIP-funded project to update North American standards requires ..",https://naturalrefrigerants.com/news/california-seeks-proposals-for-risk-assessment-of-residential-a3-heat-pumps/
2025-09-12,Natural Refrigerants,Industry News,Australian Retailer Coles Rolled Out 50 Natural Refrigerant Stores in 2024,The chain increased its natural refrigerant supermarkets from 78 to 104 and ..,https://naturalrefrigerants.com/news/australian-retailer-coles-rolled-out-50-natural-refrigerant-stores-in-2024/
2025-09-11,Natural Refrigerants,Industry News,U.S. Developer of Water-Based Refrigeration System Moving Toward Commercialization,"Inspired by CoolScupting, CleanCold Technologies’ system has a wide range of applications, ..",https://naturalrefrigerants.com/news/u-s-developer-of-water-based-refrigeration-system-seeks-manufacturing-partner/
2025-09-11,Natural Refrigerants,Industry News,IAA 2025: Automotive Suppliers Preparing Propane Thermal Management Modules for EVs,ZF and Nidec AMEC both had propane-based thermal management modules on display ..,https://naturalrefrigerants.com/news/iaa-2025-automotive-suppliers-preparing-propane-thermal-management-modules-for-evs/
2025-09-17,Danfoss,Company News,Introducing the new DST GS-series compact gas sensors: Built for extreme conditions,"The new DST GS gas sensors by Danfoss Sensing Solutions feature the company’s patented top-down inverted design in a slim, compact design with an IP66 rating, offering extra protection in extreme conditions.",https://www.danfoss.com//en/about-danfoss/news/sen/introducing-the-new-dst-gs-series-compact-gas-sensors-built-for-extreme-conditions/
2025-09-16,Danfoss,Company News,Danfoss motion portfolio: Now with VLT® Multiaxis Servo Drive 520,"VLT® Multiaxis Servo Drive 520 is the newest addition to the Danfoss VLT® FlexMotion™ servo portfolio. This innovative servo solution delivers advanced functional safety, efficiency, and seamless integration, addressing the complex demands of modern motion control applications.",https://www.danfoss.com//en/about-danfoss/news/dds/danfoss-motion-portfolio-now-with-vlt-multiaxis-servo-drive-520/
2025-09-16,Danfoss,Company News,Danfoss MP1T axial piston tandem pump boosts efficiency of dual-path propel systems in off-highway machinery,"An addition to the popular MP1 medium-power closed-circuit hydraulic platform, the Danfoss MP1T tandem pump offers high rotating efficiency, enhanced controllability, and the shortest pump length in its class. The pump is designed for construction machinery and other applications with dual-path propel systems.",https://www.danfoss.com//en/about-danfoss/news/dps/danfoss-mp1t-axial-piston-tandem-pump-boosts-efficiency-of-dual-path-propel-systems-in-off-highway-machinery/
2025-09-15,Danfoss,Company News,Introducing Danfoss hygienic gasketed plate heat exchangers:  Elevating hygienic processing standards,"Introducing Danfoss Hygienic Gasketed Plate Heat Exchangers – Elevate your hygienic processing standards with our innovative solutions designed for the food and beverage industry. Our heat exchangers are engineered with FDA-compliant materials to ensure the highest quality and meet stringent hygienic requirements. Experience exceptional performance in applications like dairy pasteurization, beverage cooling, and brewery heating. With modular frames for adaptability, frame extenders for optimized space, and versatile brackets for easy installation, streamline your operations and minimize downtime. Discover tailored solutions that enhance flexibility and efficiency. Learn more about our groundbreaking features and visit our product page for detailed information.",https://www.danfoss.com//en/about-danfoss/news/dhs/introducing-danfoss-hygienic-gasketed-plate-heat-exchangers/
2025-09-12,Danfoss,Company News,"Danfoss XL104 controller achieves ISOBUS certification, delivering reliable interoperability for agricultural equipment","The Danfoss DM-Qt display series supports Qt as a plug-in to PLUS+1® GUIDE, where user interface (UI) design can now be developed through the Qt framework — the new standard for creating embedded display UIs in the automobile industry.",https://www.danfoss.com//en/about-danfoss/news/dps/danfoss-xl104-controller-achieves-isobus-certification-delivering-reliable-interoperability-for-agricultural-equipment/
2025-09-11,Danfoss,Company News,Danfoss strengthens Benelux distribution with sale to heat exchangers experts,"Danfoss Plate Heat Exchangers is pleased to announce the sale of SONDEX B.V., based in Purmerend in the Netherlands, to heat exchanger experts Theo Thoen and Hans Ter Velde.",https://www.danfoss.com//en/about-danfoss/news/dcs/danfoss-strengthens-benelux-distribution-with-sale-to-heat-exchangers-experts/
2025-09-11,Danfoss,Company News,Beijer Ref and Danfoss Climate Solutions sign strategic agreement in Nordborg,"Monday this week marked a key milestone in our collaboration with Beijer Ref, as Danfoss Climate Solutions officially extended our partnership agreement through the end of 2027.",https://www.danfoss.com//en/about-danfoss/news/dcs/beijer-ref-and-danfoss-climate-solutions-sign-strategic-agreement-in-nordborg/
2025-09-23,Copeland-US,Company News,Copeland at AHR Expo México 2025,AHR Expo in Monterrey is the largest & most important event in the HVACR industry in Latin America.,https://www.copeland.comhttps://www.copeland.com/es-mx/events/ahr-mexico-2025
2025-09-23,Copeland-US,Company News,RNG WORKS: 2025 Technical Workshop + Trade Expo,"RNG WORKS is the premier event for the renewable natural gas industry for innovators, experts, and industry leaders.",https://www.copeland.comhttps://www.copeland.com/en-US/events/rng-works-expo
2025-09-30,Copeland-US,Company News,Visit Copeland at SIFA 2025,SIFA is the tradeshow that gathers refrigeration professionals for the latest regulatory & technical information.,https://www.copeland.comhttps://www.copeland.com/en-gb/events/sifa
2025-09-30,Copeland-US,Company News,Visit Copeland at Fruit Attraction,Fruit Attraction promotes the sector’s worldwide exports & serves as a connection point for the entire value chain.,https://www.copeland.comhttps://www.copeland.com/en-gb/events/fruit-attraction
2025-10-06,Copeland-US,Company News,"Power Today, Build Tomorrow with Copeland at ESD 2025",FMI Energy & Store Development Conference showcases the future of commercial refrigeration and building controls.,https://www.copeland.comhttps://www.copeland.com/en-US/events/fmi-energy-store-development-conference
2025-10-08,Copeland-US,Company News,Data Centre World Asia 2025,Data Centre World Asia is a global event at the forefront of innovation in the fast-changing data center industry.,https://www.copeland.comhttps://www.copeland.com/en-in/events/data-centre-world-asia-2025
2025-10-16,Copeland-US,Company News,Meet Copeland at The Global Produce and Floral Expo,Global Produce & Floral Expo is the world’s largest fresh produce & floral expo for cold chain innovations.,https://www.copeland.comhttps://www.copeland.com/en-US/events/global-produce-floral-show
2025-10-21,Copeland-US,Company News,We’re exhibiting at Intermodal Europe – the 50th Anniversary edition!,"Intermodal Europe is an event for container shipping & intermodal transport sectors to network, learn & collaborate.",https://www.copeland.comhttps://www.copeland.com/en-gb/events/intermodal-europe
2025-09-18,Copeland-Asia,Company News,Copeland Announces Sustainable Cold Chain Innovations at REFCOLD 2025,"Advances efficiency and innovation in India’s cold chain, safeguarding food wastage",https://www.copeland.com/en-in/news/copeland-at-refcold-2025
2025-09-17,Carrier-Commercial,Company News,Carrier Launches TechVantage Ignite to Develop Next-Generation HVAC Technicians and Controls Engineers,"Carrier Commercial Service and Automated Logic Field, part of Carrier Global Corporation (NYSE: CARR), global leader in intelligent climate and energy solutions, have launched the first cohorts of TechVantage Ignite, a program to develop the next generation of commercial HVAC technicians and controls engineers.",https://www.carrier.com/commercial/en/us/news/news-article/carrier-launches-techvantage-ignite-to-develop-next-generation-hvac-technicians-and-controls-engineers.html
2025-09-15,Carrier-Commercial,Company News,Investing in Tomorrow's HVAC Technicians: Carrier Launches New Initiative with TechForce,"Carrier Global Corporation (NYSE: CARR), global leader in intelligent climate and energy solutions, is expanding its commitment to develop service trade technicians of the future through a new collaboration with TechForce Foundation, designed to encourage HVAC career paths and workforce readiness. This new agreement builds on Carrier’s ongoing investments to grow U.S. manufacturing, innovation and skilled jobs, and its previously announced TechVantage Initiative, which aims to hire 1,000 U.S. service technicians and train more than 100,000 across Carrier and its ecosystem.",https://www.carrier.com/commercial/en/us/news/news-article/investing-in-tomorrow-s-hvac-technicians--carrier-launches-new-initiative-with-techforce.html
2025-09-11,Carrier-Commercial,Company News,Carrier Sets Benchmark with First U.S. DOE-Validated 10-14-Ton Commercial Rooftop Unit,"Carrier Global Corporation (NYSE: CARR), global leader in intelligent climate and energy solutions, today announced it is the first HVAC original equipment manufacturer to complete the U.S. Department of Energy’s (DOE) Commercial Building HVAC Technology Challenge laboratory validation in the 10–14-ton rooftop heat pump category. The Carrier system met or exceeded all challenge requirements, including heating capacity and energy efficiency test standards — delivering 100% heating capacity at 5°F, exceeding 70% heating capacity at -10°F and meeting or surpassing DOE’s commercial HVAC efficiency thresholds.",https://www.carrier.com/commercial/en/us/news/news-article/carrier-sets-benchmark-with-first-u-s--doe-validated-10-14-ton-commercial-rooftop-unit.html
2025-09-18,Carrier-Transicold,Company News,Castell Howell Extends Longstanding Collaboration with Carrier Transicold with 20 New Supra HE 13 MT Units,"Castell Howell has continued its 33-year collaboration with Carrier Transicold with the delivery of 20 new Supra® High Efficiency (HE) 13 Multi-Temperature (MT) units – the first multi-temperature models of the system to be deployed on UK roads. Based in Carmarthenshire, the food wholesaler continues to lead in fleet innovation, consistently selecting advanced solutions from Carrier Transicold’s portfolio to power its extensive range of temperature-controlled trucks and trailers. Carrier Transicold is a part of Carrier Global Corporation (NYSE: CARR), global leader in intelligent climate and energy solutions.",https://www.carrier.com/truck-trailer/en/eu/news/news-article/castell-howell-extends-longstanding-collaboration-with-carrier-transicold-with-20-new-supra-he-13-mt-units.html
2025-09-19,Lennox,Company News,Lennox Declares Quarterly Dividend,"DALLAS , Sept. 19, 2025 /PRNewswire/ -- The Lennox (NYSE: LII) board of directors approved a quarterly cash dividend of $1.30 per share of common stock, payable October 15, 2025 , to stockholders of record as of September 30, 2025 . About Lennox Lennox (NYSE:  LII ) is a leader in energy-efficient",https://investor.lennox.com/news-releases/news-release-details/lennox-declares-quarterly-dividend-4
2025-09-16,Honeywell,Company News,Honeywell Introduces Personal Shopper Technology to Reinvent the Shopping Experience in Europe,"Next-generation, self-service technology opens up new possibilities for shoppers and retailers, enabling quicker and smoother checkout processes and personalise...",https://www.honeywell.com/us/en/press/2025/09/honeywell-introduces-personal-shopper-technology-to-reinvent-the-shopping-experience-in-europe
2025-09-16,Honeywell,Company News,Honeywell Announces Pricing of Solstice Advanced Materials' Offering of Senior Notes in Connection with Planned Spin-Off,"Solstice has priced a private offering of $1 billion aggregate principal amount of senior notes due 2033 (the ""Notes"").",https://www.honeywell.com/us/en/press/2025/09/honeywell-announces-pricing-of-solstice-advanced-materials-offering-of-senior-notes-in-connection-with-planned-spin-off
2025-09-16,Honeywell,Company News,Honeywell Announces Launch of Solstice Advanced Materials' Offering of Senior Notes in Connection with Planned Spin-Off,"Honeywell announced that, in connection with the previously announced spin-off (the ""Spin-Off"") of Solstice Advanced Materials Inc. (""Solstice"") from Honeywell,...",https://www.honeywell.com/us/en/press/2025/09/honeywell-announces-launch-of-solstice-advanced-materials-offering-of-senior-notes-in-connection-with-planned-spin-off
2025-09-19,Carel,Company News,Avicola Bacco embraces sustainable refrigeration with CAREL solutions,"Avicola Bacco, a leading company in the processing of poultry meat, has completed a major modernisation project at its plant by adopting a  CO  2   refrigeration system, developed with CAREL...",https://www.carel.com/news-detail/avicola-bacco-embraces-sustainable-refrigeration-with-carel-solutions
2025-09-12,Carel,Company News,CAREL at Host 2025: an innovation journey reshaping food service,"CAREL will take part in  Host Milano 2025 , the leading international event for the hospitality industry, showcasing its solutions for food service.  

 The CAREL offering stands out for the...",https://www.carel.com/news-detail/carel-at-host-2025-an-innovation-journey-reshaping-food-service
2025-09-20,JARN News,Industry News,Avicola Bacco embraces sustainable refrigeration with CAREL solutions,"Avicola Bacco, a leading company in the processing of poultry meat, has completed a major modernisation project at its plant by adopting a CO2 refrigeration system, developed with CAREL solutions and installed by MD Service Refrigerazione. The goal: to ensure the highest product quality, reduce energy consumption and contribute to a more sustainable future.",https://www.ejarn.com/article/detail/90482
2025-09-20,JARN News,Industry News,Airedale by Modine Releases High Capacity Turbocor® Chiller for Data Center Industry,Airedale by Modine release TurboChillTM  DCS  to deliver improved cooling capacity in higher ambient temperatures for colocation & hyperscale data centers.,https://www.ejarn.com/article/detail/90481
2025-09-20,JARN News,Industry News,Copeland Announces Sustainable Cold Chain Innovations at REFCOLD 2025,"(Sept. 18, 2025) – Copeland, a global provider of sustainable climate solutions, is launching its next-generation of cold chain solutions including the energy efficient ZB series compressor, A2L-optimized CF series compressor and a regional launch of the Copeland Mobile app featuring Scout AI. These solutions are being introduced in New Delhi, India at REFCOLD 2025, India's premier cold chain and refrigeration industry event where Copeland is spotlighting the urgent need for efficient solutions to reduce food losses, lower emissions and build resilient cold chain systems.",https://www.ejarn.com/article/detail/90480
2025-09-20,JARN News,Industry News,Trane Technologies Ignites a New Era for Smart Buildings with Game-Changing AI Controls and AI Agent,"--(BUSINESS WIRE)-- Trane Technologies (NYSE:TT), a global climate innovator, today announced two groundbreaking developments: AI Control and ARIA, leveraging advanced technology to keep customers at the forefront of building optimization and energy management.",https://www.ejarn.com/article/detail/90478
2025-09-20,JARN News,Industry News,Weatherite & Condair - a cool partnership,"When Weatherite needed to develop an innovative cooling solution that didn’t rely on man-made refrigerants, it turned to Condair’s adiabatic cooling expertise. The partnership resulted in Weatherite’s innovative AdTec-D direct cooling system, which is now a highly proven free air-cooling unit, used by leading telecoms and data centre clients.",https://www.ejarn.com/article/detail/90477
2025-09-20,JARN News,Industry News,Carrier Transicold Launches Reefer Enhancement and Next-Life Program to Boost Fleet Efficiency and Sustainability,"Carrier Transicold has launched the Reefer Enhancement and Next-life (REN) Program, an innovative solution aimed at extending the service life, improving energy efficiency and reducing total operating costs of mid-life PrimeLINE® refrigerated units. The REN Program marks the newest advancement within Carrier’s Transform Line, a portfolio of modernizations and retrofit solutions empowering transport refrigeration customers to meet evolving demands with their existing fleets while maximizing return on investment. Carrier Transicold is part of Carrier Global Corporation (NYSE: CARR), global leader in intelligent climate and energy solutions.",https://www.ejarn.com/article/detail/90476
2025-09-20,JARN News,Industry News,Carrier Joins the World Business Council for Sustainable Development (WBCSD),", Sept. 18, 2025 - Carrier Global Corporation (NYSE: CARR), global leader in intelligent climate and energy solutions, has joined the World Business Council for Sustainable Development (WBCSD), a leading community of global businesses making sustainability performance a key driver for competitiveness.",https://www.ejarn.com/article/detail/90475
2025-09-20,JARN News,Industry News,Samsung and TELUS Collaborate on Canada’s First AI-Powered RAN Intelligent Controller To Optimize Network Performance and Energy Efficiency,"Samsung Electronics and TELUS today announced that they will deploy Canada’s first commercial Radio Access Network Intelligent Controller (RIC), marking a significant milestone toward fully software-based, AI-powered networks. Samsung will provide its RIC solution, including open multi-vendor support and a rich suite of applications as part of Samsung CognitiV Network Operations Suite (NOS), to further enable intelligent automation, enhanced energy efficiency and optimized performance across TELUS’ wireless network.",https://www.ejarn.com/article/detail/90474
