PublishDate,Source,Type,Title,Summary,Link
2025-09-26,Contractor Mag - Management,Industry News,How Video and Training Led to 3X Business Growth,"Tripling a business doesn’t happen overnight. For Barron Heating, AC, Electrical & Plumbing, it came from two core commitments: finding the right people and building the right systems. Video became their tool to earn trust with customers and attract new talent, while training turned green hires into future leaders.",https://www.contractormag.com/management/best-practices/article/55318525/how-video-and-training-led-to-3x-business-growth
2025-09-23,Contractor Mag - Management,Industry News,"Tariffs, Trade and Construction Contractors","Tariff policies will have wide-ranging cost implications for construction companies beyond the price of overseas building materials. Historically, global tariffs have also raised prices on domestically made materials.",https://www.contractormag.com/management/best-practices/article/55318392/tariffs-trade-and-construction-contractors
2025-09-23,Contractor Mag - Management,Industry News,6 Unsolvable Plumbing Problems (and Why They Don’t Matter),"Every plumbing company has problems. Some are internal and largely in the control of the owner. Others are external and owners often feel helpless in the face of them. In truth, you have more control than you think. It all depends on your approach. Here are six common problems that most plumbers consider unsolvable, but are not even problems.",https://www.contractormag.com/management/marketing/article/55318366/6-unsolvable-plumbing-problems-and-why-they-dont-matter
2025-09-24,Contractor Mag - Codes,Industry News,IAPMO Releases 2025 Report on Proposals for 2027 WE•Stand Code,"ONTARIO, CA — IAPMO®, developer of the Water Efficiency and Sanitation Standard (WE•Stand), has released the 2025 Report on Proposals for the upcoming 2027 edition of the model code. The report is available online only; no printed version will be distributed.",https://www.contractormag.com/codes/news/55318868/iapmo-releases-2025-report-on-proposals-for-2027-westand-code
2025-09-24,Contractor Mag - Codes,Industry News,"IAPMO Elects New Leaders, Honors Industry Achievements at 2025 Conference","PALM SPRINGS, CA — Plumbing and mechanical professionals from across North America gathered Sept. 14-18 for IAPMO®’s 2025 Education and Business Conference at the Renaissance Palm Springs Hotel. The event ran in conjunction with ASSE International’s Annual Meeting and ARCSA International’s Annual Conference.",https://www.contractormag.com/codes/news/55318813/iapmo-elects-new-leaders-honors-industry-achievements-at-2025-conference
2025-09-24,Contractor Mag - Codes,Industry News,Rock & Roll Vibes Energize IAPMO Conference in Palm Springs,"PALM SPRINGS, CA — A high-energy week filled with education, networking and code development, all wrapped in the vibrant atmosphere of one of California’s most iconic destinations, last month’s IAPMO® Education and Business Conference featured a bold, rock ’n’ roll-inspired theme. The experience was designed to be energetic and immersive, capturing the laid-back, desert-style of Palm Springs, while celebrating the passion and innovation that drive the industry.",https://www.contractormag.com/industry-event-news/news/55318616/rock-roll-vibes-energize-iapmo-conference-in-palm-springs
2025-09-27,Contractor Mag - Hydronics,Industry News,High-Demand Kitchen Solves Hot Water Challenges with Cyclone Flex,"NASHVILLE, TN — When restaurateur Carey Bringle opened Bringle’s Smoking Oasis in 2021, he knew the operation would need a high-performance hot water system to keep up. The 2,800-square-foot Southwest-style barbecue spot has indoor seating for 40, outdoor seating for 300, and a dish pit that runs nonstop throughout operating hours. In a restaurant where hot water can’t run out, Bringle turned to the A. O. Smith Cyclone® Flex commercial water heater.",https://www.contractormag.com/hydronics/article/55319608/high-demand-kitchen-solves-hot-water-challenges-with-cyclone-flex
2025-09-27,Contractor Mag - Hydronics,Industry News,"Weekly Product Gallery: General Pipe Cleaners, Lochinvar, LIXIL, Kohler, Brass Knuckle, Cat Footwear","Kelly L. Faloon is a contributing editor and writer to Contractor, Contracting Business magazine and HPAC Engineering and principal of Faloon Editorial Services. The former editor of Plumbing & Mechanical magazine, Faloon has more than 26 years of experience in the plumbing and heating industry and more than 35 years in B2B publishing. She started a freelance writing and editing business in 2017, where she has a varied clientele.",https://www.contractormag.com/media-galleries/media-gallery/55319306/weekly-product-gallery-general-pipe-cleaners-lochinvar-lixil-kohler-brass-knuckle-cat-footwear
2025-09-23,Contractor Mag - Hydronics,Industry News,Electrical Infrastructure In Boiler Rooms: A Mechanical Contractor’s Guide,"Boiler rooms serve as hubs that house electrical and mechanical systems, requiring careful infrastructure design and planning. The right setup ensures that these systems are able to operate safely and reliably to reduce the risk of fires and other hazards while also minimizing downtime.",https://www.contractormag.com/hydronics/article/55318261/electrical-infrastructure-in-boiler-rooms-a-mechanical-contractors-guide
2025-09-26,Contractor Mag - Tools,Industry News,From Shop Class to Flat Track: CTE Students Build Race-Ready Harley,"Northern Tool, with help from DEWALT and Milwaukee, has donated tens of thousands of dollars worth of tools and equipment to the LaVergne High School classroom that will help them build the race-ready motorcycle.",https://www.contractormag.com/training/news/55319264/from-shop-class-to-flat-track-cte-students-build-race-ready-harley
