PublishDate,Source,Type,Title,Summary,Link
2025-09-21,CoolingPost-World,Industry News,All-in-one propane heat pump for apartments,"GERMANY: A German residential real estate company plans to install over 1,000 packaged air-source propane heat pump units in apartment buildings.",https://www.coolingpost.com/world-news/all-in-one-propane-heat-pump-for-apartments/
2025-09-20,CoolingPost-World,Industry News,XNRGY boosts AI chiller production,"USA: Thermal management and liquid cooling systems manufacturer XNRGY is to build a brand-new, 330,000ft2 facility in Mesa, Arizona, dedicated to producing its next-generation air-cooled chiller.",https://www.coolingpost.com/world-news/xnrgy-boosts-ai-chiller-production/
2025-09-19,CoolingPost-World,Industry News,Brunei ratifies Kigali Amendment,BRUNEI DARUSSALAM: Brunei Darussalam has become the latest country to have officially ratify the Kigali Amendment to phase down HFCs.,https://www.coolingpost.com/world-news/brunei-ratifies-kigali-amendment/
2025-09-19,CoolingPost-World,Industry News,Johnson Controls awarded $156m US defence contract,USA: Johnson Controls has been awarded a $156m contract to supply chillers and related equipment to the US Department of Defense.,https://www.coolingpost.com/world-news/johnson-controls-awarded-156m-us-defence-contract/
2025-09-22,CoolingPost-UK,Industry News,Nominations invited for J&E Hall Gold Medal,"UK: The Institute of Refrigeration is now inviting nominations for the annual J&E Hall Gold Medal, one of the most internationally respected accolades in the RACHP industry.",https://www.coolingpost.com/uk-news/nominations-invited-for-je-hall-gold-medal/
2025-09-22,CoolingPost-UK,Industry News,Daikin UK transfers after-sales to Robert Heath,"UK: Daikin UK has transferred all its residential after-sales service operations in England and Wales to Robert Heath Heating, the Surrey-based service and maintenance company it acquired last year.",https://www.coolingpost.com/uk-news/daikin-uk-transfers-after-sales-to-robert-heath/
2025-09-19,CoolingPost-UK,Industry News,IOR president is “Local Hero”,UK: Institute of Refrigeration president Lisa-Jayne Cook was amongst the winners last night at the Top 100 Most Influential Women in Construction Awards 2025.,https://www.coolingpost.com/uk-news/ior-president-is-local-hero/
2025-09-21,CoolingPost-Products,Industry News,Trane targets smart buildings,USA: Trane Technologies has targeted smart buildings with new AI controls and AI agent.,https://www.coolingpost.com/products/trane-targets-smart-buildings/
2025-09-20,CoolingPost-Products,Industry News,High capacity Turbocor chiller for data centres,"UK: Airedale by Modine has announced the 2MW TurboChill DCS, the next generation in their range of Turbocor compressor chillers.",https://www.coolingpost.com/products/high-capacity-turbocor-chiller-for-data-centres/
