PublishDate,Source,Title,Summary,Link
2025-08-23,CoolingPost-World,Honeywell progresses spin-off plans,"USA: Honeywell has progressed plans to spin off its Advanced Materials business this year, filing its Form 10 registration statement and announcing its future board for the new Solstice business.",https://www.coolingpost.com/world-news/honeywell-progress-spin-off-plans/
2025-08-22,CoolingPost-World,Carrier enables 2-week delivery of R454B,"USA: With the US continuing to suffer shortages of lower GWP refrigerant R454B, Carrier has announced that it is now fulfilling R454B refrigerant orders within two weeks from time of order.",https://www.coolingpost.com/world-news/carrier-enables-2-week-delivery-of-r454b/
2025-08-22,CoolingPost-World,Daikin Europe opens €140m R&D centre,"BELGIUM: After two and a half years of construction, Daikin’s €140m EMEA Development Centre (EDC) is now operational.",https://www.coolingpost.com/world-news/daikin-europe-opens-e140m-rd-centre/
2025-08-21,CoolingPost-World,Modine opens Chennai factory,"USA: Modine has officially opened its new 100,000ft2 factory in Chennai, India, to meet accelerated demand for data centre cooling across the APAC region.",https://www.coolingpost.com/world-news/modine-opens-chennai-factory/
2025-08-21,CoolingPost-World,Vertiv buys data rack and cabinet company,"UK/USA: Vertiv Holdings has successfully completed the $200m acquisition of Great Lakes Data Racks & Cabinets, a leading manufacturer of innovative data rack enclosures and integrated infrastructure solutions.",https://www.coolingpost.com/world-news/vertiv-buys-data-rack-and-cabinet-company/
2025-08-22,CoolingPost-Products,CTC adds high capacity R290 ATW heat pump,"SWEDEN: CTC has announced the launch of the EcoAir 720M, the highest-capacity unit in its EcoAir 700M range of modulating air-to-water heat pumps.",https://www.coolingpost.com/products/ctc-adds-high-capacity-r290-atw-heat-pump/
