PublishDate,Source,Type,Title,Summary,Link
2025-09-23,JARN,Industry News,IFA2025｜Midea SPACE MASTER Series Debuts [1/2],", Sept. 5, 2025– Midea, part of the Fortune Global 500 Midea Group, has placed the SPACE MASTER kitchen, cleaning and air conditioning appliances in the limelight at IFA 2025. Built around the idea of delivering surprisingly larger spaces within standard sizes, the series redefines what users can expect from everyday appliances.",https://www.ejarn.com/article/detail/90517
2025-09-23,JARN,Industry News,Mitsubishi Electric: happy anniversary to the best HVAC system ever,"F-Gas is changing our industry. Since the phasedown commenced in 2015, all major manufacturers have acquired Chiller businesses to manage the threat to the traditional VRF market.",https://www.ejarn.com/article/detail/90516
2025-09-23,JARN,Industry News,Airedale: Sustainable Cooling Solutions for High-Density Data Centers,"The extraordinary growth of cloud services and AI applications, along with the resultant increase in data processing needs and network traffic, is driving unprecedented demand for data center capacity. According to the global consulting firm McKinsey & Co, total data center capacity could nearly triple by 2030. As data centers strive to meet the growing demand, many operators, particularly hyperscalers, are pushing toward ever-higher rack densities.",https://www.ejarn.com/article/detail/90515
2025-09-23,JARN,Industry News,Combat: Are Radiant Heaters Right for your Premises?,Choosing the right heating system for your warehouse or workshop isn’t always straightforward. Every building has its quirks that make choosing a heating system that little bit trickier. One option more and more businesses are turning to is radiant heating.,https://www.ejarn.com/article/detail/90514
2025-09-23,JARN,Industry News,The smart HVAC revolution comes to C&R 2025 with new space dedicated to regulation and control,"Developed in collaboration with AFEC, this technical-professional forum will address the strategic role of regulation and control systems in the digitization, decarbonization, and efficient and sustainable management of buildings. From 18 to 20 November 2025, the International Air Conditioning and Refrigeration Exhibition will convene sector professionals under the theme “Innovation for Decarbonisation”.",https://www.ejarn.com/article/detail/90513
2025-09-25,JARN-Interviews,Industry News,LG ES Company Driving the Future of Global HVAC Innovation,"JARN interviewed Cheunghyun (John) Bae, executive vice president (EVP) and head of Commercial Air Conditioning Business, LG Eco Solution (ES) Company, to hear about the company’s successes and strategies enabling it to become a top-tier solutions provider in the global heating, ventilation, and air conditioning (HVAC) industry.",https://www.ejarn.com/article/detail/90507
2025-09-25,JARN-Interviews,Industry News,Epta Advances Sustainable Refrigeration Innovation,"JARN interviewed Massimo Marcer, general manager for APAC and Middle East at Epta, to hear about the company’s various achievements in driving sustainable refrigeration innovation in these regions.",https://www.ejarn.com/article/detail/90500
2025-09-25,JARN-Interviews,Industry News,"Prihoda, the Juggernaut of the Fabric Diffuser Industry","Prihoda is a Czech-based manufacturer that has pioneered the fabric air distribution system industry. Founded in 1994, Prihoda now exports its fabric diffusers to over 70 countries worldwide. Its products are used in commercial, industrial, and agricultural applications. JARN interviewed Zdenek Příhoda, founder and chief executive officer (CEO), to hear about Prihoda’s philosophy, latest inno…",https://www.ejarn.com/article/detail/90499
2025-09-25,JARN-Interviews,Industry News,Panasonic Expands Its Leadership in CO2 Refrigeration Field,"Panasonic’s Cold Chain Solutions Company (Panasonic CCS Co) achieved impressive results in fiscal year (FY) 2024 ending March 2025, recording an adjusted operating profit of 20.1 billion yen (about US$ 136 million). JARN interviewed Manabu Tsuchimoto, director of CDU business, assistant director of Cold Chain Business Division, Panasonic CCS Co, to learn about the factors behind this strong p…",https://www.ejarn.com/article/detail/90501
