PublishDate,Source,Type,Title,Summary,Link
2025-09-17,Natural Refrigerants,Industry News,"More Regulation of F-Gases May Be Needed Because of TFA Link, Says ECHA’s Updated PFAS Proposal","Existing legislation, which focuses on GWP, does not address the risks associated ..",https://naturalrefrigerants.com/news/more-regulation-of-f-gases-may-be-needed-because-of-tfa-link-says-echas-updated-pfas-proposal/
2025-09-17,Natural Refrigerants,Industry News,Adaptation 2025: Pressure Exchanger Boosts Efficiency of Transcritical CO2 System by 15% in Hungarian Hypermarket,The technology from U.S. manufacturer Energy Recovery can also support reliable system ..,https://naturalrefrigerants.com/news/adaptation-2025-pressure-exchanger-boosts-efficiency-of-transcritical-co2-system-by-15-in-hungarian-hypermarket/
2025-09-16,Natural Refrigerants,Industry News,ECHA’s Updated PFAS Proposal Retains Most Restrictions on PFAS Refrigerants,Many HVAC&R applications keep their original exemption period though MAC is given ..,https://naturalrefrigerants.com/news/echas-updated-pfas-proposal-retains-most-restrictions-on-pfas-refrigerants/
2025-09-16,Natural Refrigerants,Industry News,Hanon Systems Has Built More Than 1 Million CO2 E-Compressors for Electric Vehicles,"The e-compressors are supplied to Volkswagen, which uses them in EVs built ..",https://naturalrefrigerants.com/news/hanon-systems-has-built-more-than-1-million-co2-ecompressors-for-electric-vehicles/
2025-09-16,Natural Refrigerants,Industry News,"Johnson Controls’ 42MW Ammonia Heat Pump System to Deliver District Heating to 15,000 Homes in Zurich","The units, part of a local utility project, will recover heat from ..",https://naturalrefrigerants.com/news/johnson-controls-42mw-ammonia-heat-pump-system-to-deliver-district-heating-to-15000-homes-in-zurich/
2025-09-15,Natural Refrigerants,Industry News,The Expert Opinion: Why the AIM Act Isn’t Going Anywhere and What That Means for Natural Refrigerant Planning,"Amrit Robbins, CEO and Co-founder of Axiom Cloud, on how AIM Act ..",https://naturalrefrigerants.com/news/the-expert-opinion-why-the-aim-act-isnt-going-anywhere-and-what-that-means-for-natural-refrigerant-planning/
