PublishDate,Source,Type,Title,Summary,Link
2025-08-29,RefIndustry,Industry News,GIZ launches tender for pilot QCR system in Brazil’s refrigeration sector,"The Deutsche Gesellschaft für Internationale Zusammenarbeit (GIZ) GmbH has opened a tender to select an institution to develop and implement a pilot Qualification, Certification, and Registration (QC",https://refindustry.com/news/market-news/giz-launches-tender-for-pilot-qcr-system-in-brazil-s-refrigeration-sector
2025-08-29,RefIndustry,Industry News,AIIR partners with HavTech to distribute HVAC systems in U.S. Mid-Atlantic,"AIIR Products, a provider of AI-powered heating and cooling systems, has announced a strategic partnership with HavTech, a major HVAC solutions supplier in the U.S. Mid-Atlantic region. The collab",https://refindustry.com/news/market-news/aiir-partners-with-havtech-to-distribute-hvac-systems-in-u-s-mid-atlantic
2025-08-29,RefIndustry,Industry News,Efficiency for Access outlines low-carbon design for solar cold rooms in Kenya,"Efficiency for Access has released a report titled Designing for Sustainability: Blueprint for a Low-Carbon Cold Room, presenting a set of 10 best practices for reducing the environmental impact of so",https://refindustry.com/news/market-news/efficiency-for-access-outlines-low-carbon-design-for-solar-cold-rooms-in-kenya
2025-08-29,RefIndustry,Industry News,Magnavale opens Category 3 frozen storage facility in Lincolnshire,"Magnavale has opened a dedicated Category 3 frozen storage facility at its Easton site in Lincolnshire, UK, increasing the company’s national capacity for storing non-human consumption goods.
 
 T",https://refindustry.com/news/cold-chain/magnavale-opens-category-3-frozen-storage-facility-in-lincolnshire
