PublishDate,Source,Type,Title,Summary,Link
2025-08-28,RefIndustry,Industry News,Refrigeration Monitoring Market to Reach USD 16.46 Billion by 2032,"The global refrigeration monitoring market is projected to grow from USD 8.38 billion in 2023 to USD 16.46 billion by 2032, at a CAGR of 7.84%, according to SNS Insider. Growth is being driven by",https://refindustry.com/news/market-research/refrigeration-monitoring-market-to-reach-usd-16-46-billion-by-2032
2025-08-28,RefIndustry,Industry News,Carrier Japan joins Tsuyama Open Factory 2025 to engage local students,Carrier Japan welcomed 19 elementary school students and their families to its Tsuyama factory in Okayama Prefecture on July 25 as part of the Tsuyama Area Open Factory 2025 initiative. Organized by t,https://refindustry.com/news/market-news/carrier-japan-joins-tsuyama-open-factory-2025-to-engage-local-students
2025-08-28,RefIndustry,Industry News,C4 Project Marks 10 Years Advancing Climate-Friendly Cooling,"The Cool Contributions fighting Climate Change (C4) project, funded by Germany’s BMUKN and implemented by GIZ Proklima, has concluded after a decade of work to integrate sustainable refrigeration an",https://refindustry.com/news/market-news/c4-project-marks-10-years-advancing-climate-friendly-cooling
2025-08-27,RefIndustry,Industry News,J & E Hall compressor used in marine pack for fishing vessel in Mexico,Sirsa Titanio has integrated the J & E Hall HSO 3216 compressor into a new marine refrigeration pack developed at its manufacturing facility in Mexico. The system is designed for refrigerated sea,https://refindustry.com/news/market-news/j-e-hall-compressor-used-in-marine-pack-for-fishing-vessel-in-mexico
2025-08-27,RefIndustry,Industry News,Thermo King launches ECOmode to cut fuel use in Advancer trailer units,"Thermo King, a brand of Trane Technologies, has introduced ECOmode, a new operating feature for its Advancer trailer refrigeration units. The mode is designed to help fleet operators reduce fuel consu",https://refindustry.com/news/new-items/thermo-king-launches-ecomode-to-cut-fuel-use-in-advancer-trailer-units
2025-08-27,RefIndustry,Industry News,SPIE acquires Dutch firm Voets & Donkers to expand industrial refrigeration services,"SPIE, a European provider of multi-technical services in energy and communications, has acquired Voets & Donkers Koeltechniek B.V. and VND Technical Services B.V. in the Netherlands. The acquisiti",https://refindustry.com/news/market-news/spie-acquires-dutch-firm-voets-donkers-to-expand-industrial-refrigeration-services
2025-08-27,RefIndustry,Industry News,CIBSE announces 2025 MENA Awards shortlist for building services excellence,"The Chartered Institution of Building Services Engineers (CIBSE) has announced the shortlist for the 2025 CIBSE MENA Awards, highlighting achievements in building services engineering across the Middl",https://refindustry.com/news/market-news/cibse-announces-2025-mena-awards-shortlist-for-building-services-excellence
2025-08-27,RefIndustry,Industry News,Fujitsu General joins Paloma Rheem Group,"Fujitsu General announced that it has completed procedures following the public tender offer for its common shares by Paloma Rheem Holdings Co., Ltd. (Paloma Rheem HD). As a result, the company has be",https://refindustry.com/news/market-news/fujitsu-general-joins-paloma-rheem-group
